question,table
"How many times does the string ""CLE"" appear as the parent team in the ""Calculation_40532458114363409"" column?",MLB_49
What is the number of Grounds Into Double Plays (GIDP) when the Left-Handed (LD) batting average is less than 0.9?,MLB_49
What is the minimum value of the Str. metric when the year is 2012 and the GB value is equal to 1?,MLB_49
Determine the total average value for all data points corresponding to the year 2013.,MLB_49
"Determine the number of instances where the batting average on balls in play (BABIP) falls within a specific range, and further filter the results to only include leagues with the designation 'PCL'.",MLB_49
Identify the number of instances where the Blood Pressure (BIP) reading is recorded when the Heart Rate (HR) is equal to zero.,MLB_49
"How many times does the phrase ""p_throws"" appear when the combination of letters ""AB"" is equal to the number ""2""?",MLB_49
What is the average on-base percentage when a batter grounds into a double play and their fielding percentage is greater than 0.9?,MLB_49
Determine the specific geographic area within the county of Middlesbrough that corresponds to the unique identifier '{F21ACA89-9549-4C58-9822-1C56EBC46E91}' for postal purposes.,RealEstate2_1
Determine the quantity of entries that possess a town/city URL containing the specific location 'STOCKTON-ON-TEES' when the town/city name is identical to 'STOCKTON-ON-TEES' and the county name is also 'STOCKTON-ON-TEES'.,RealEstate2_1
How many entries in the dataset feature a specific postal code area when the corresponding postal code sub-area is TW12 2?,RealEstate2_1
What is the value of New_Build when the calculation with ID 222787466265260036 is designated as an existing entity?,RealEstate2_1
"Determine the numerical value associated with the identifier Calculation_222787466264023043, provided that the transaction type denoted by Price_Paid_Transaction_Type is specifically classified as 'A'.",RealEstate2_1
What is the cumulative total of longitudinal coordinates when the latitude value is precisely 54.5853722377112?,RealEstate2_1
"""Obtain the postal sector code where the postal district is 'TS6' and the type of property transaction is 'Auction'.""",RealEstate2_1
What is the name of the administrative division when the town or city's unique identifier is 'HATHEROP-ROAD-TW12'?,RealEstate2_1
What is the maximum number of records associated with the specific postal code 'TS10 1NQ'?,RealEstate2_1
Determine the total quantity of entries that have a geographic designation of 'THORNABY' specified.,RealEstate2_1
What is the value of FHINS7P when the recorded weight for the 18th data point is zero and the value of HINS1 is two?,USCensus_3
"Determine the cumulative total of wgtp39 values, assuming record 43 has a weight of zero and FMARP also equals zero.",USCensus_3
Determine the grand total of PAP values when the weight associated with record number 54 is equal to 158.,USCensus_3
"Determine the cumulative total of wgtp18 values, assuming record 31 has a weight of zero and FHINS7P also has a value of zero.",USCensus_3
What is the value of wgtp43 when the value of ANC2P is equal to '999' and the weight associated with record number 18 is '0'?,USCensus_3
Determine the aggregate value of wgtp39 where HINS1 equals '2' and ADJINC1 is equal to '1007549'.,USCensus_3
Determine the value of FBUSP when the recorded weight for the 43rd entry is zero.,USCensus_3
Determine the mean value of wgtp6 when the PAP value is zero and the weight associated with record number 29 is also zero.,USCensus_3
What is the value of FMRGP when the value of HINS1 is equal to 2 and the weight associated with record number 39 is zero?,USCensus_3
How many times does the sequence FMRGP appear when the value of DEYE is equal to one?,USCensus_3
How many instances in the A129 column contain the specific combination of characters 'C26A'?,SalariesFrance_7
"What is the total number of entries in the ""REPERE1 (copie)"" column that contain the digit '1'?",SalariesFrance_7
What is the total count of data entries where the 'CP_PRINCIPAL' field contains the specific value '88800' and also includes the exact string 'AG_50_54'?,SalariesFrance_7
"How many entries in column A88 of the ADECCO_NB_CAND_METIERS_PROCHES dataset contain the digit ""27""?",SalariesFrance_7
"How many employee records in the ""Name"" table have a specific geographic code of '51230' stored in the ""Principal"" field?",SalariesFrance_7
How many database entries in the A129_LIBCOURT_PJ table have the value '20250' stored in the CP_PRINCIPAL field?,SalariesFrance_7
How many records in the database contain the value '20137' in the CP_PRINCIPAL field?,SalariesFrance_7
Retrieve the ADECCO_NB_CANDIDATS value corresponding to the REPERE1 (copy) field with a value of '1'.,SalariesFrance_7
"Retrieve the raw salary value associated with the specific combination of ""WISSEMBOURG-67"" as the pages' name and ""C26A"" as the A129 code from the database.",SalariesFrance_7
"Retrieve the specific numerical value associated with the calculation ID ""Calculation_393783518250995712"" where the library court code ""A129_LIBCOURT"" matches the exact phrase ""Fab. éqpt irrad. médic. et électromedic."".",SalariesFrance_7
"What is the specific postal code area that corresponds to the Burradon region, which falls within the NE23 postal district?",RealEstate2_2
"What is the specific postal code allocated to residences that underwent a change in ownership on January 1, 2006, and are situated within the BN9 9 postcode sector?",RealEstate2_2
"What is the typical cost of residential real estate with the postal code NN4 0UD and a specific property address starting with number one, which is 64?",RealEstate2_2
What is the designation given to parcels of land that are already developed and recorded on the official maps?,RealEstate2_2
What is the secondary property address detail for assets with a transaction classification of 'A'?,RealEstate2_2
How many entries in the database have a unique identifier matching the value '{FF91AEAE-1EB7-4B60-9857-55F42AF4E587}'?,RealEstate2_2
What is the minimum cost of real estate listings with a geographic location east of the prime meridian (5° longitude) and not designated as recently constructed properties?,RealEstate2_2
What is the total value of all real estate listings labeled as being located in the city of London?,RealEstate2_2
"Which geographic area, defined by a unique combination of letters and numbers, is home to properties that have only a single corresponding data entry?",RealEstate2_2
What is the current construction progress of residential areas within the W6 postal code region?,RealEstate2_2
"What is the typical length of time spent at the TA NCB for the ""Preventa"" channel when there are no standard sales and transfer times for AUTOPREVENTA?",Rentabilidad_8
Determine the minimum expenditure required for a standard telesales agent in the absence of variable expenses related to AUTOVENTA.,Rentabilidad_8
Determine the total number of pathways in the Ruta PR system for the specific locations designated as 'Sede' sites.,Rentabilidad_8
"What is the specific team or department responsible for the rollout of the ""GVC 2.0"" sales strategy?",Rentabilidad_8
"Determine the average quantity of goods carried by the traveling representative of AUTOVENTA, assuming there are no fixed expenses associated with AUTOPREVENTA.",Rentabilidad_8
What is the mean value of the Fx PR metric when Autopreventa has no variable expenses and the total Cost of Sales (CdS) falls within a predetermined scope?,Rentabilidad_8
"How many locations are classified as ""Regional/Foreign"" when there are no expenses for leasing sales equipment and variable expenses for vehicle sales?",Rentabilidad_8
Determine the recurring expenditure for logistics operations when there are no costs associated with leasing sales tools.,Rentabilidad_8
Determine the quantity of municipalities that are classified as 'P' within the Global Energy Efficiency Coalition (GEC) grouping.,Rentabilidad_8
Determine the total cost of portable gadgets utilized in the Preventa routes for the account holder '1310477093' when the cumulative cost of services exceeds a threshold of $0.50.,Rentabilidad_8
What is the PPM Pass Flag value when the actual total distance lies between 22.12 and 22.72 kilometers?,TrainsUK2_2
"At what precise moment is the starting point scheduled to occur when the PPM Pass Flag is set to ""enabled"" and the Time Stamp Counter (TSC) reads ""12226820""?",TrainsUK2_2
"How many times do timestamps indicating a deliberate starting point appear when the target is ""Paris"" and the area is ""Residential""?",TrainsUK2_2
"How many records have a matching timestamp with the specified origin date and time, and also have a destination Stanox code of '50311', when the origin timestamp is '2013-04-02 10:13:00.000000'?",TrainsUK2_2
"Which logical operator is linked to the value ""2N43"" in the Calculation_6080608165132814 variable, and simultaneously, is associated with the PPM Pass Flag having a value of ""1""?",TrainsUK2_2
Determine the aggregate total of PPM Pass Flag values for records with a destination Stanox code equal to '36702'.,TrainsUK2_2
"What is the intended starting point of Stanox, given that the timestamp for the origin is April 2nd, 2013, at 10:13:00 AM?",TrainsUK2_2
How many times does the intended arrival time appear in the description of the destination station code 'Horsham'?,TrainsUK2_2
"""Obtain the detailed description of the service group for records where the real-time flag is set to 'active'.""",TrainsUK2_2
Determine the quantity of records featuring a specific calculation ID ('Calculation_9230610113105724') in conjunction with a particular TSC ('24674005') and sector ('LSE').,TrainsUK2_2
"What is the number of records in the 'Fx CO' column that meet two specific conditions: the 'REPARTO' column contains the exact phrase ""Merma de Ruta"" and the 'Razón Social' column matches a particular company name?",Rentabilidad_5
What is the expense of leasing telemarketing gear when there are no senior sales team leaders available?,Rentabilidad_5
"What are the duration and travel expenses associated with standard pre-purchase procedures when the cumulative total equals a predetermined amount, and the individual involved is Paula Andrea Bedoya Taborda?",Rentabilidad_5
What is the total count of recorded visits when the allocated visit quota for distributors is set to zero and the dynamic route costs fall below a specific benchmark?,Rentabilidad_5
What are the expenses associated with leasing telecommunications infrastructure for international deployment?,Rentabilidad_5
What is the maximum percentage of unsold products when there are no returns from customers who cancelled their orders before the sale?,Rentabilidad_5
What is the number of data points that have a distinct label when the variable expense for pre-orders is equal to zero?,Rentabilidad_5
"What is the maximum duration from initial sale to final delivery of a vehicle when there is no delay in the sales process and the transfer of ownership, but the route network experiences significant inefficiencies?",Rentabilidad_5
What is the overall cost of maintaining a predetermined transportation schedule when introducing a sales strategy in a foreign market?,Rentabilidad_5
"In a scenario where there are no fixed costs associated with pre-sales and no automatic sales load, how many sales routes are documented?",Rentabilidad_5
"In Pennsylvania, what is the midpoint of the time it takes for properties to be sold, showing a minor decline in this metric compared to the previous month?",Redfin2_2
Which records indicate a rise in stock levels and are geographically located within the state of Rhode Island?,Redfin2_2
"Which properties in Oregon have a sales-to-list price ratio that is lower than the average, and how many of these properties are there?",Redfin2_2
"What is the typical shift in the midpoint of housing market values from the preceding month, considering all data points up to and including August 31, 2009?",Redfin2_2
What is the minimum variation in the proportion of sale prices to original asking prices for Oregon properties whose proportion of sale prices to original asking prices lies between 0.0674 and 1.8674?,Redfin2_2
What is the number of records that include a geographic area description when the time frame is exactly one month long?,Redfin2_2
What kind of geographic area is typically linked to listings that experience a median duration of time on the market fluctuation of approximately one week?,Redfin2_2
"What is the smallest proportion of actual sales to original asking prices for listings that were initially posted on August 1, 2009?",Redfin2_2
"What is the minimum alteration in stock records for transactions that initiate on August 1, 2009, and are associated with a unique identifier of 2344?",Redfin2_2
"What is the median price of a single entry in a dataset, considering the prices from lowest to highest?",Redfin2_2
What is the lowest 'Edition Position' value when the 'Page Hour' is equal to '241600'?,Generico_2
What is the length of time when there is a single commercial and it is Monday?,Generico_2
What is the broadcast frequency when the display indicators are inactive and the announcement is a sponsored segment?,Generico_2
At what specific period does the platform for broadcasting visual content take precedence?,Generico_2
What is the result of combining two time expressions when the length of the time period is 30 minutes and the specific time range is from midnight to 6:00 AM?,Generico_2
What is the typical week number for TV programs broadcast between midnight and 6:00 AM?,Generico_2
What is the numerical value of the disk when the cut-off point is set to one?,Generico_2
What is the total number of initial listings in the telecommunications industry?,Generico_2
How many motor vehicle records are associated with the label 'CANAL 7'?,Generico_2
How many website records are there when the second combination of text is the File Transfer Protocol (FTP) link and the category is 'NOTICIAS'?,Generico_2
What is the maximum number of temporary employees when the number of new recruits falls within a particular scope?,SalariesFrance_4
Which financial activity category has the largest proportion of female participants?,SalariesFrance_4
How many females fall within the demographic range of being older than 30 years and younger than 40 years?,SalariesFrance_4
What is the total count of employees who started working in areas with a geographical longitude of less than 40 degrees east?,SalariesFrance_4
What is the total number of data entries that have a unique label when the geographic region is Vichy-03?,SalariesFrance_4
What is the average number of businesses when the majority of staff members are female and fall under a distinct occupational classification?,SalariesFrance_4
"What is the number of employee records that have a particular salary value, where the majority of employees in the dataset are male?",SalariesFrance_4
What is the classification of households when the quantity of recent recruits and the proportion of workers within the age range of 25 to 29 years exceed specific benchmarks?,SalariesFrance_4
What is the average value of the variable when the proportion of male employees is less than 50%?,SalariesFrance_4
What is the aggregate total of complex situations that arise when a particular classification is concerned?,SalariesFrance_4
What is the minimum value of Dev_uni_proxima when the quantity sold today is 56 and the sales today exceed half a unit?,Bimbo_1
How many instances are there where the requested amount is precisely 53 units and the sales figures for the current day exceed 0.3?,Bimbo_1
"""What is the total count of sales transactions recorded for the customer with the unique identifier 23443 as of the current date?""",Bimbo_1
"How many times does the phrase ""Dev_uni_proxima"" appear when the number of items sold today is twenty-seven and the subsequent return is zero?",Bimbo_1
"Identify the product with the largest ID that is associated with a channel having an ID of 1, and also has a next return quantity of zero.",Bimbo_1
Identify the earliest customer identifier associated with a total sales amount of exactly $249.60.,Bimbo_1
What is the mean value of the return amount for the route with the identifier 1025?,Bimbo_1
What is the largest customer identifier associated with a specific communication medium?,Bimbo_1
"For the customer with the unique identifier 23443, what is the required amount if the sales figures for the current day lie between 243.82 and 245.02?",Bimbo_1
What is the total count of unique identifiers when there is only one data entry?,Bimbo_1
"What is the number of young adults, aged 24 or younger, employed in the financial services sector, including banking and insurance, who have experienced a significant salary boost of at least 90%?",SalariesFrance_3
What is the minimum outcome when the proportion of goals exceeds a tenth of the total?,SalariesFrance_3
What is the lowest wage threshold in a specific geographic area denoted by the numerical code '38449'?,SalariesFrance_3
What is the maximum salary increase that occurs when a specific mathematical formula surpasses 90% and the number of newly employed individuals is precisely 6.58454427754567% of the total workforce?,SalariesFrance_3
"How many records are there in the financial activities sector, specifically within the insurance and retirement funds category, that have a particular salary and a specific calculation outcome labeled as ""Financial High School Assurance and Retirement Funds""?",SalariesFrance_3
What is the total count of applicants where a distinct characteristic is present and the exact number of people with an age below 25 is 2.4896928533007?,SalariesFrance_3
"How many instances are there where the ""A129_LIBCOURT"" field contains the exact phrase ""Act. financ. hs assur. et cais. retraite"" and the ""A129_LIB"" field is specifically labeled as ""Finance""?",SalariesFrance_3
"What is the outcome of a specific mathematical operation when the challenge or complexity of the task lies within a narrow band of values, roughly spanning from slightly below average to slightly above average?",SalariesFrance_3
"How many instances are there where the ""A129_LIBCOURT"" field contains the specific value ""Act. financ. hs assur. et cais. retraite"", the new hires' salaries are less than 60% of the total, and the training field is specifically categorized as ""GESTION-EN-BANQUE-ET-ASSURANCE""?",SalariesFrance_3
"What are the typical compensation packages for professionals working in the insurance and pension fund industries, which are closely tied to the banking and insurance training sectors?",SalariesFrance_3
What is the total number of bases reached by a batter when they have walked four times and been hit by a pitch zero times?,MLB_10
Which baseball team has a weighted runs created above average (wRAA) value that is less than zero?,MLB_10
How many times does the average value (AVG) exist and is not empty for Derek McCallum?,MLB_10
"What is the total value of GB when the OBP is within a narrow range of -0.5 to 0.5, and there is only one data point?",MLB_10
"What is the total value of the player's contract for the Minnesota NBA team, considering only the players who are part of the main roster?",MLB_10
"Determine the number of instances where James Beresford's batted balls in play resulted in a hit, given that he has accumulated a total of 4 successful hits.",MLB_10
Identify the wRAA values that fall within a scope of minus six to plus six.,MLB_10
What is the value of H when the weighted Runs Created (wRC) metric equals a negative 127?,MLB_10
Identify the team names where Reggie Williams' X3B value is zero.,MLB_10
What is the mean value of X2B when PU equals 2?,MLB_10
"Which Major League Baseball player, known by the nickname ""Scott Diamond"", is linked to a specific level in the sport's hierarchy?",MLB_4
"How many times does the data combination of ""aaa"" for the home team's level and ""dub"" for the away team appear in the dataset?",MLB_4
What is the standard number of times the teams take turns playing offense and defense when the score is being recorded in the fifth segment of the game?,MLB_4
Determine the quantity of players on the same team when the batter's stature measures exactly six feet zero inches.,MLB_4
"What is the mean value of the ""x"" variable when the visiting team is identified as ""roc""?",MLB_4
"Which sports competition is linked to a unique score of ""one"" and a level of uncertainty lower than 0.7?",MLB_4
"How many pitcher names are there when the value of ""our.y"" exceeds the threshold of 0.5?",MLB_4
Determine the quantity of tiers when the game segment is at its fourth stage.,MLB_4
"What is the specific game or instance when the calendar date is August 31st, 2013, and the player at the plate is Eric Thames?",MLB_4
"How many baseball player names are associated with the team that plays as the host when their abbreviation is ""Dub""?",MLB_4
What is the longest period of time allowed for routine sales and handovers in pre-sales when the customer's ID is '1300358530' and the cost of rotating pre-sales and telesales personnel is less than 10 cents?,Rentabilidad_4
What is the largest cost component for switching between pre-sales representatives and phone sales agents when the delivery dates are irregular and the overall delivery efficiency is optimal?,Rentabilidad_4
"When the auto sales threshold for free delivery is zero, which sales route is designated for non-cash transactions?",Rentabilidad_4
What is the maximum debt level when there are no third-party rental fees and no standard sales periods for tele-sales?,Rentabilidad_4
What is the transmission factor when the overall delivery efficiency is at its maximum?,Rentabilidad_4
How many General Electric Company (GEC) National Contract Board (NCB) records are there when the sales channel is identified as 'BS3308' and the delivery schedule is marked as 'V'?,Rentabilidad_4
What are the typical lengths of telesales calls when the costs associated with adapting the sales route exceed half a unit?,Rentabilidad_4
"What is the total distance when the administrative approach is ""Body Surface Area 3"" and the geographical site is ""Bogota, Colombia""?",Rentabilidad_4
"What is the most significant expense item for distributors in the specified time frame of January 1, 2012 to January 2, 2012, assuming a delivery factor of unity?",Rentabilidad_4
Which geographic classification corresponds to a meridian with a value of negative 74 degrees?,Rentabilidad_4
Which company is linked to a particular type of data connection and a lack of distinct fields?,Motos_2
How many units are associated with the vehicle designated as 'CVI- XEW'?,Motos_2
Which type of data is associated with a specific website and lacks a defined structure?,Motos_2
What is the latest deadline for publishing ads that have only a single entry?,Motos_2
What is the broadcast schedule for an advertisement that is linked to a particular online platform and coincides with the final day of the week?,Motos_2
"What type of joining operation was employed for advertisements on January 7, 2007?",Motos_2
What is the standard page count for online advertisements that use Windows Media Video file format?,Motos_2
What is the total number of days of the week that radio and television transmission companies advertise on?,Motos_2
What is the first day of the week on which television program advertisements appear in the 'PROGRAMAS TELEVISIVOS' category during the second week of the programming schedule?,Motos_2
Which type of advertising is characterized by a particular sequence and combination of elements?,Motos_2
"Determine the cumulative delay to reach 5% of the scheduled journey time for trains operated by South Western Trains, given a scheduled journey duration of 16 minutes and 0 seconds.",TrainsUK1_3
"Determine the quantity of records where the operator's designation is ""HU"".",TrainsUK1_3
Determine the earliest scheduled departure time among the trains listed in Timetable 'M16'.,TrainsUK1_3
Determine the median delay for trains in Timetable 'M16' that exhibit a frequency of on-time arrivals of less than 80%.,TrainsUK1_3
What are the specifics of the timing event and section title when the scheduled time is 16 minutes past the hour?,TrainsUK1_3
Determine the quantity of entries featuring a performance bonus of zero and handled by the entity identified as 'HU'.,TrainsUK1_3
Determine the standard deviation for train routes terminating at 'Ramsgate' with a specific headcode classification.,TrainsUK1_3
Retrieve the name of the final station for trains with a total of 119 units.,TrainsUK1_3
"Identify the instances with an average tardiness of approximately 1 hour and 2 minutes, and a specific calculation description of ""A"".",TrainsUK1_3
"Determine the shortest duration required for trains to reach a 2% delay threshold, assuming a minimum punctuality rate of 80% and originating from 'London Charing Cross' station.",TrainsUK1_3
What is the lowest material code value associated with a specific tributary code of '1070'?,TableroSistemaPenal_3
What is the average value of the count of data entries when the code for the tributary is specifically '1070'?,TableroSistemaPenal_3
"How many occurrences of ""COD_TRIB"" are present when the ""DELITO"" value is 'LESSE GRAVES INJURIES'?",TableroSistemaPenal_3
"What is the tribunal value when the year of the cause is 2010 and the date and time of the hearing is January 1, 2010, at 10:46 AM?",TableroSistemaPenal_3
What is the value of COD_CTE when the CORTE field contains the string '91- SAN MIGUEL'?,TableroSistemaPenal_3
