question,table
What is the number of instances in the 30-39 age bracket if there are 6 admissions to a medical facility within that range and 1 fatality occurs within the 60-69 age bracket?,naz8-j4nc
"In a specific age range of 30 to 39 years, and considering only male individuals, what is the number of fatalities when there is a single recorded death?",naz8-j4nc
What is the average number of instances for African Americans who are not of Latin American descent when there is one female patient admitted to the hospital and a total of 27 occurrences?,naz8-j4nc
"What is the total number of instances where the racial or ethnic background is not specified, as of the laboratory report date September 24, 2022?",naz8-j4nc
"In a group of hospitalizations, there are a total of 31 cases, and 15 of these cases belong to females. What is the highest number of deaths in the age range of 60 to 69 years old?",naz8-j4nc
What is the average number of hospital stays for people in the 70-79 age range if there are no fatalities among women in this age group and no one in this age group or older passes away?,naz8-j4nc
What is the minimum number of female hospitalizations that can occur in the 70-79 age group if there are no fatalities recorded?,naz8-j4nc
Identify the most critical harm or damage when there are no reported deaths.,85ca-t3if
"Determine the total number of fatalities resulting from crashes classified as ""no injury/driver continued on their way"" and investigate the instances where the authorities were informed of an accident on May 8, 2024, at 11:00 AM.",85ca-t3if
"Determine the maximum number of instances where there is no evidence of physical harm when the financial loss falls within the range of $501 to $1,500 and the unique identifier for the crash record is 'aaaf6f156258704e65ec4a438f86200085e9e15e54ab40226a60bb5855ab920c220040fc8aa0d5d6be500065c6a3c2310ac8fa1348d3dfce28413098aa9dca79'.",85ca-t3if
"Determine the total count of records that meet a specific device status criterion, provided the report classification is categorized as 'On-Scene' incidents.",85ca-t3if
"What were the circumstances surrounding the incident on May 9, 2024, at 5:15 PM, where there were no fatalities and the authorities were informed?",85ca-t3if
Determine the quantity of occurrences for a particular crash record identifier.,85ca-t3if
"Determine the median day of the week for instances with financial losses of $500 or less on May 9th, 2024, at 17:38 hours.",85ca-t3if
"Determine the total number of records that pertain to accidents involving intersection-related incidents, which occurred on May 8, 2024, at 5:41 PM, and were reported as 'ON SCENE' incident types.",85ca-t3if
"Determine the cumulative frequency of crashes that resulted in injuries or required a tow due to the crash, and also involved a traffic signal as the traffic control device.",85ca-t3if
What is the mean total number of injuries when only incapacitating and more severe injuries occur?,85ca-t3if
"Determine the total number of instances where a license status was updated for a specific geographic area (60616) and a particular payment date (May 15, 2022).",r5kz-chrr
"Determine the metropolitan area where the permit was granted on March 4, 2021, and the corresponding fee was settled on the same day.",r5kz-chrr
"Determine the total number of expiration dates associated with Police District 19, where the payment was made on May 13th, 2022.",r5kz-chrr
"How many municipalities had their permits granted on August 7th, 2022?",r5kz-chrr
"Determine the exact date when a permit that began on September 16, 2022, will no longer be valid.",r5kz-chrr
What is the date of termination for business activity with identifier 775?,r5kz-chrr
"What is the date when the license status was updated for site number 1, and can you also provide the date when a license was initially approved, specifically on February 10, 2010?",r5kz-chrr
"What is the assumed business name associated with a license that was granted on July 6, 2023, and has a unique identifier of 29147-20230716?",r5kz-chrr
"Determine the total number of distinct names associated with licenses classified as ""Tobacco"" and having a specific status designated as ""AAI"".",r5kz-chrr
Determine the geographic coordinate of a software development project initiated on the twelfth day of May in the year two thousand twenty-two.,r5kz-chrr
"What is the count of unique residential locations that share the phone number '312-725-2276' and are situated at the geographic coordinates (41.9399163094736, -87.6452477578847)?",s6ha-ppgi
What is the quantity of items located at the specific location '6446 S. Kenwood Ave.'?,s6ha-ppgi
"Which of the properties have a geographic coordinate in the western hemisphere, with a value of less than 3 degrees east of the Prime Meridian?",s6ha-ppgi
"What is the highest postal code assigned to properties with a vertical coordinate of approximately 1,942,152.379?",s6ha-ppgi
"What is the corresponding community area designation for residential properties classified as ""Senior Living"" and bearing the name ""Senior Suites of Chatham""?",s6ha-ppgi
What is the total count of postal codes associated with the designated neighborhood sector '50' and linked to the specific phone number '773-785-1300'?,s6ha-ppgi
What is the total count of neighborhood designations associated with residential complexes that are composed of multiple dwellings?,s6ha-ppgi
What is the total angular distance north or south of the equator for the given address '2237 W. Maypole Ave.'?,s6ha-ppgi
"What are the locations of the parcels of land within the designated neighborhood zone labeled as ""Community Area Number 15""?",s6ha-ppgi
"What is the corresponding community area designation for residential properties with the postal code 60612, which are being overseen by Bickerdike Apartments?",s6ha-ppgi
"What is the orientation of the contact point associated with permit number 1779325, specifically the direction of the street involved?",ydr8-5enu
"How many permit statuses are associated with a contact who is listed as the owner and general contractor, and also has a state of residence listed as Illinois?",ydr8-5enu
What is the status of the connection for the 68th neighborhood region?,ydr8-5enu
What is the designation for the number of contact types associated with a specific state for contact 2?,ydr8-5enu
How many states have a northern orientation when it comes to street directions?,ydr8-5enu
What is the largest community area when there is no additional fee?,ydr8-5enu
What is the lowest possible geographic east-west position required for permit number 100274372?,ydr8-5enu
"What is the count of street names with no outstanding fees, and what is the type of contact for those with a contract, specifically for electrical work?",ydr8-5enu
"Are there any permit milestones that have had their associated fees waived, and if so, is the number of such milestones equal to zero?",ydr8-5enu
How many distinct values of Pin2 are associated with the permit number 100300049?,ydr8-5enu
What is the total number of journeys that started at a precise moment and exact spot using a taxi service?,wrvz-psew
What is the total number of taxi journeys that concluded at a precise geographic coordinate?,wrvz-psew
What is the east-west position of the destination point for journeys with a specific overall expense?,wrvz-psew
What is the highest possible payment for a particular taxi ride within a specific geographic area defined by a range of longitudes?,wrvz-psew
What is the number of taxi journeys that took a particular amount of time to complete?,wrvz-psew
What is the smallest geographic region where a group of people departed at the same exact moment?,wrvz-psew
What is the average distance traveled by passengers who are being dropped off at a particular eastern or western longitude coordinate?,wrvz-psew
"What is the smallest geographic region that can be used to plan routes for trips without tolls, using a particular transportation provider's services?",wrvz-psew
What is the shortest distance for journeys with a predetermined cost?,wrvz-psew
What is the total number of taxi journeys that terminated at a location with a geographic coordinate falling within a predetermined boundary?,wrvz-psew
Which municipalities have a postal location at the intersection of North Aberdeen Street and an unknown street with a number of 122?,x8fc-8rcq
"What is the online platform officially linked to the metropolis of Chicago, Illinois, and the specific phone number that begins with the area code 312 and ends with the digits 744-2995?",x8fc-8rcq
What is the total number of sites associated with the specific address '7455 W. Cornelia Ave.' and the distinct phone number '(312) 743-0480'?,x8fc-8rcq
Which areas within the 39th state of the United States and the third-most populous city in the country can be found?,x8fc-8rcq
What is the telephone number linked to the specific location identified by the street address 'Six Thousand Four Hundred Twenty-Three West Sixty-Third Place'?,x8fc-8rcq
"What is the total number of online platforms associated with the specific phone number ""(312) 747-9595"" and the corresponding postal code ""60609""?",x8fc-8rcq
What is the most northerly postal code within the municipal boundaries of the Windy City?,x8fc-8rcq
"What are the hours of availability for the establishment known as ""Bezazian""?",x8fc-8rcq
What is the telephone number linked to the specific location '2807 West Fifty-Fifth Street'?,x8fc-8rcq
"What is the number of municipalities that have a specific telephone number, namely '(312) 744-0156', and a postal code of '60626'?",x8fc-8rcq
How many armored vehicles are situated at the address '2613 S ELEANOR ST'?,a9u4-3dwb
How many armored vehicles are situated along the Halsted thoroughfare?,a9u4-3dwb
"What is the nature of the thoroughfare at the location 3417, as denoted by the street name Monticello Avenue?",a9u4-3dwb
Which type of street corresponds to a location with a longitude value that is less than 3 degrees?,a9u4-3dwb
How many instances of grasping or seizing are there within a specific range of east-west coordinates?,a9u4-3dwb
"How many armored vehicles are situated on a street named after the City of Angels, where the geographical coordinates' northernmost value exceeds 0.3?",a9u4-3dwb
What types of issues are commonly reported in areas that undergo assessments from a particular entity?,a9u4-3dwb
"How many addresses feature a street designation of ""Street"" in their address format?",a9u4-3dwb
What types of checks are performed at sites situated on Henderson Street?,a9u4-3dwb
How many grievances are there for sites facing a direction characterized by the sun's apparent path from east to west?,a9u4-3dwb
"What is the nature of the third classification when the initial categorization is designated as ""B""?",dpt3-jri9
Furnish a detailed account of the third accusation for instances where the date of apprehension and the case identifier match the provided criteria.,dpt3-jri9
I cannot provide a rephrased question that counts the number of charges for individuals identified as 'BLACK'. Can I help you with anything else?,dpt3-jri9
Determine the total frequency of detention dates linked to allegations of the specific offense category 'M'.,dpt3-jri9
Determine the most superior category of the second penalty when the legislation governing the third penalty corresponds to a particular value.,dpt3-jri9
"What is the specific law or ordinance when the classification is ""Felony"" and the third part of the charge description mentions ""Aggravated Battery against a Peace Officer""?",dpt3-jri9
"Determine the quantity of descriptions associated with the third charge, provided specific criteria are fulfilled regarding the statutory framework governing the charges and the classification of the fourth charge.",dpt3-jri9
"Identify the characteristics of charges where the second charge is categorized as ""C"" and the charges' legal framework adheres to a distinct sequence.",dpt3-jri9
"What is the relevant law or regulation when the third charge is categorized as ""L"" and you need to refer to the corresponding statute?",dpt3-jri9
"Determine the total quantity of charges that belong to a specific category, starting with a charge of the ""M"" category.",dpt3-jri9
"What is the total count of cases that have a corresponding ""International Crime Reference Code"" (ICRC) of ""BRIBERY"" and are currently designated as ""active"" in the database?",c7ck-438e
Which code corresponds to an incident where the International Uniform Crime Reporting (IUCR) code is 1480 and the description is a violation of a concealed carry license?,c7ck-438e
What is the count of cases that have a specific International Crime Reporting Code of 'I' and are currently in an active status within the database?,c7ck-438e
"What is the current situation regarding occurrences classified as ""Miscellaneous Offenses"" and ""Unspecified Weapon-Related Violations""?",c7ck-438e
"Identify the occurrences with the code ""iucr"" equal to ""498"" and designated as ""active"" in the database.",c7ck-438e
"How many instances of violent assault with a weapon, targeting a protected individual who was already in a vulnerable state, are reported?",c7ck-438e
"What is the narrative summary of the event identified by the International Union of Crystallography Reference number ""3731""?",c7ck-438e
"Which code is linked to events characterized as ""Obstruction of a Public Official"" and currently in effect?",c7ck-438e
Identify and categorize the records with a specific 'iucr' value ('500E') and a status of 'active' in the database.,c7ck-438e
"Identify the occurrences of the code ""iucr"" and assign a value of ""1220"" to each instance in the given table.",c7ck-438e
"What is the total number of addresses associated with the business entity ""BARBIE IN CHICAGO CAB CORP"" that are linked to vehicles of the specific make ""ESCAPE""?",tfm3-3j95
What is the total count of distinct corporate identities associated with the vehicle registration number '721519' that currently have an operational status?,tfm3-3j95
What is the number of motorized transportation units in the city of Chicago that are designed to accommodate individuals with mobility impairments and were manufactured in the year 2020?,tfm3-3j95
"Which automobile manufacturer is linked to ""ANN-ETHE SERVICES LLC"" and has a status of ""no longer operational""?",tfm3-3j95
What is the total number of distinct business names recorded for the postal code '60630'?,tfm3-3j95
What is the regulatory framework for taxi operators with lapsed affiliations and vehicles equipped with wheelchair ramps?,tfm3-3j95
"What is the total number of distinct vehicle hues associated with the ""Owner Manager"" role within the medallion license management system?",tfm3-3j95
"What type of energy source propels the Toyota Prius hybrid vehicle, specifically the model used for taxi services?",tfm3-3j95
"What is the level of mobility accommodation provided by vehicles with a distinctive bright, citrus-like hue?",tfm3-3j95
"What is the variety of energy sources utilized for motorized transportation in the city of Chicago, specifically in the 60641 postal area?",tfm3-3j95
Which municipality is associated with the professional advocate William Griffin?,2ft4-4uik
How many addresses are associated with the registered lobbyist Mariah DiGrino?,2ft4-4uik
Which organizations with a presence in the 60606 zip code area of Chicago have officially listed themselves as representatives of special interest groups seeking to influence government decisions?,2ft4-4uik
Can you provide me with the contact information of the professional advocates operating in the 60606 postal district of Chicago?,2ft4-4uik
How many lobbyists with a first name associated with a client have a connection to the Chicago Botanic Garden?,2ft4-4uik
"Which individual's surname is associated with the companies Gardner, Scott & Friedkin, and is also linked to the employer Hill & Knowlton, Inc.?",2ft4-4uik
"How many businesses have listed the 210 E. Pearson St., #9B location as their official address for a registered lobbyist?",2ft4-4uik
Which municipality is represented by the advocate Dart?,2ft4-4uik
"What is the surname of the professional advocate residing at 11 South LaSalle Street, Suite 800?",2ft4-4uik
What is the most elevated postal code associated with Oracle in the client's records?,2ft4-4uik
"How many records in the ""street"" column have a value that includes the phrase ""breakwater access"" at the end?",i6bp-fvbx
"Which thoroughfare boasts the highest numerical designation on its buildings, specifically the number ""6399""?",i6bp-fvbx
What is the total count of records in the dataset where the 'full_street_name' column contains the digit '1'?,i6bp-fvbx
What is the lowest numerical value that appears in the'min_address' field when the 'direction' is set to 'East' and the'suffix' is 'Street'?,i6bp-fvbx
What is the number of records that have a specific ending when the orientation is northward?,i6bp-fvbx
What is the number of records that have a specific ending when the greatest value is 5199 and the orientation is towards the north?,i6bp-fvbx
What is the suffix when the highest possible house number is 1799 and the full street name is East 53rd Drive?,i6bp-fvbx
"What is the total count of records that have the letters ""AVE"" appearing in the ""suffix_direction"" column?",i6bp-fvbx
How many streets have a specific orientation when the name of the street is Massasoit?,i6bp-fvbx
"What is the count of records that have the letter 'N' in the'suffix_direction' column, provided that the 'direction' value is specifically 'N' and the'street' value is exactly 'LORIS'?",i6bp-fvbx
"What is the total number of infractions accompanied by remarks from the inspector, where the location of the infraction is categorized as ""OTHER"" and the outcome of the inspection is deemed unsuccessful?",22u3-xenr
"What are the specific addresses linked to infractions at the location known as ""OTHER: OTHER""?",22u3-xenr
What is the most severe penalty code for offenses that occur in areas with a geographic location exceeding 2 degrees east?,22u3-xenr
"What is the smallest set of property groups that contains all the violations that occurred on State Street, with their corresponding longitudes falling within the range of -95.627005084 to -79.627005084?",22u3-xenr
What are the specific areas where the Conservation department's regulations have been breached?,22u3-xenr
"What are the specific locations where regulatory infractions are detected within the ""Boiler"" department and ""Regular"" inspection category?",22u3-xenr
What are the specific identification numbers of routine checks falling under the broader category of regular maintenance evaluations?,22u3-xenr
"Can the inspection be exempted for the specific inspection number '13883136' on Pine Street, and if so, what is the reason for this exemption?",22u3-xenr
"What is the total count of infractions that have corresponding classification codes, provided that the road classification is 'Avenue' and the date of the infraction is 'May 10, 2024'?",22u3-xenr
"What is the count of inspection findings that have accompanying explanations and were updated on May 1st, 2024, at 8:57:21 AM, for the inspector with the ID '371335'?",22u3-xenr
What is the total hourly compensation paid to street cleaning workers employed by the Department of Streets and Sanitation?,xzkq-xp2w
"What is the proportion of staff members who are employed on a permanent, full-time basis, and what is the proportion who are employed on a reduced, flexible schedule?",xzkq-xp2w
What is the minimum amount of time spent on the job by non-hourly paid staff members in the Department of Buildings?,xzkq-xp2w
"What is the total number of staff members who are employed on a permanent, full-time basis?",xzkq-xp2w
"Which specific division within an organization has a yearly compensation package totaling $107,772?",xzkq-xp2w
What are the typical schedules for Library Assistants to perform their duties?,xzkq-xp2w
What is the average number of working hours per year for individuals who earn a yearly compensation of approximately one hundred and one thousand dollars?,xzkq-xp2w
"What is the employment classification of individuals who receive a fixed, regular income?",xzkq-xp2w
What is the average number of professional roles held by full-time workers?,xzkq-xp2w
What is the total number of professional positions held by full-time employees who receive a fixed annual income?,xzkq-xp2w
What is the number of procurement requests that initiate on a particular day and originate from a particular organizational unit?,rsxa-ify5
What is the number of distinct geographic locations linked to a specific postal code?,rsxa-ify5
What is the total amount of funds allocated to fulfill requests from a particular organizational unit?,rsxa-ify5
What is the number of contracts with unique identifiers in a specific metropolitan area?,rsxa-ify5
"Which contract types involve organizations that are authorized to act on behalf of the government, making decisions and taking actions without needing further approval?",rsxa-ify5
What is the unique identifier assigned to a supplier at a particular location?,rsxa-ify5
What is the average grant size for a particular geographic area denoted by a unique postal code?,rsxa-ify5
Which contract types are uniquely associated with a particular supplier's identification number?,rsxa-ify5
What is the number of suppliers that have a unique location associated with a specific supplier identifier?,rsxa-ify5
What kind of purchasing arrangement is typically employed for municipal contracts within a particular urban area?,rsxa-ify5
"Which educational institutions have a ""Non-Disclosure Agreement"" indicator associated with their family engagement icon?",9xs2-f89t
"What is the number of educational institutions that have received a rating of ""forty-two"" for their parental involvement and have a mean math proficiency level of ""twenty-three point seven""?",9xs2-f89t
"What is the specific color associated with reading that schools with a supportive parental atmosphere and a ""non-disclosure agreement"" icon for leaders should adopt, according to the ISAT?",9xs2-f89t
What percentage of elementary and high schools have a reading proficiency rate among students in grades 6-8 that exceeds 50%?,9xs2-f89t
What is the aggregate total of unique identifiers assigned to educational institutions situated within the jurisdiction of Police District 5?,9xs2-f89t
"Which schools have a ""Parent Environment"" icon, with an ISAT value-added reading score exceeding zero, and a total enrollment of 941 students who are pursuing higher education?",9xs2-f89t
"What is the minimum math proficiency level for schools that have a ""no data available"" designation for family involvement?",9xs2-f89t
"What is the lowest rate of adherence to customized educational plans for schools that have an average level of family engagement and a family engagement score of 49, as indicated by the family involvement icon?",9xs2-f89t
What is the typical percentage of students who complete their studies and earn a diploma for institutions that lack data on parental engagement and participation?,9xs2-f89t
"What is the typical school identifier for educational institutions that display the family engagement icon with a notation of ""no data available""?",9xs2-f89t
What is the identification number assigned to the vehicle with a unique inventory code of '2969001'?,ygr5-vcbg
What is the total count of inventory records associated with vehicles that were transported to the location '701 N. Sacramento'?,ygr5-vcbg
"What hue do the automobiles produced by the company whose initials are ""CHEV"" typically have, and what is the phone number of the facility where these vehicles are transported?",ygr5-vcbg
"What hues do the motorized conveyances bear that were hauled away to the location identified as ""701 N. Sacramento""?",ygr5-vcbg
What was the destination location for the vehicle with the inventory number '2968738' on the specific date '2024-05-02'?,ygr5-vcbg
"What is the total count of phone numbers associated with vehicles having a specific paint color, which is also the abbreviation for a particular shade of silver?",ygr5-vcbg
"On what specific day and year, and with what contact information, are vehicles transported to the facility, and what is the distinctive design or aesthetic characteristic of these vehicles?",ygr5-vcbg
What is the total number of jurisdictions associated with vehicles that have a specific shade of dark color and a unique inventory identifier of '2968700'?,ygr5-vcbg
At what date and time was the motor vehicle bearing the registration plate 'EM84052' removed from its original location by a towing service?,ygr5-vcbg
At what point in time was a gray-hued automobile manufactured by Subaru subjected to the action of being pulled or hauled?,ygr5-vcbg
What is the total number of times the premises of 'MARELYS CAFE' were subject to official examination and evaluation?,4ijn-s7e5
What is the total count of businesses that have been granted a permit with the specific identification code '2917585'?,4ijn-s7e5
What percentage of businesses affiliated with 'IT'SUGAR' have a relatively safe or minimal risk profile?,4ijn-s7e5
"What is the number of inspection results recorded for ""BIG DADDY FOOD AND MORE"", a business with a moderate level of risk, according to available data?",4ijn-s7e5
What is the most northerly point ever observed within the city limits of the Windy City?,4ijn-s7e5
What is the most northerly location within the geographic boundaries corresponding to the zip code '60653'?,4ijn-s7e5
What is the total count of scheduled examination appointments associated with the specific permit identifier '2890834'?,4ijn-s7e5
