question,table
"What is the frequency of individuals with the given first name ""John"" among the group of professionals who represent special interests and influence policy decisions?",2ft4-4uik
What are the identities of the organizations that have listed themselves as clients with lobbying firms operating in the 60601 zip code area of Chicago?,2ft4-4uik
"What is the metropolitan area that is home to the location with the address '111 E. Wacker Drive, Suite 2800' and the postal code 60601?",2ft4-4uik
Which metropolitan area is home to the professionals in the 60601 postal district who specialize in influencing government decisions?,2ft4-4uik
"What is the count of individuals with the first name ""Steven"" and a residential address matching ""322 South Green Street"" among the registered lobbyists?",2ft4-4uik
"What is the number of registered lobbyists associated with the Illinois Governmental Consulting Group, LLC, and are they based in Chicago?",2ft4-4uik
"How many individuals with a professional affiliation linked to the address 222 Merchandise Mart Plaza, Suite 275 have registered as lobbyists?",2ft4-4uik
What is the total number of individuals or organizations associated with advocacy firms in the 60610 postal code?,2ft4-4uik
"What is the total number of individuals or organizations currently engaged in communication with representatives of the government, who are associated with individuals bearing the surname 'Lawlor' in a professional capacity?",2ft4-4uik
"What is the given name of the advocate with the surname ""Linsley"" and a postal code of 60606?",2ft4-4uik
What is the total of the lowest street address numbers for roads that have an eastward orientation?,i6bp-fvbx
"What is the total number of thoroughfares bearing the designation ""Drive""?",i6bp-fvbx
"What is the full designation of the thoroughfare whose address begins with the numerical sequence ""2800""?",i6bp-fvbx
What is the number of thoroughfares that have a descriptive term appended to their name when the numerical designation begins with the number one?,i6bp-fvbx
"What are the complete street names that contain the numerical sequence ""79TH"" and have a maximum house number of 3099?",i6bp-fvbx
What are the numerical designations that follow the address number '732' to identify specific streets?,i6bp-fvbx
"What is the lowest possible street address that is one less than the highest possible street address, given that the highest possible street address is 899?",i6bp-fvbx
What is the smallest possible starting point for street names that run from east to west?,i6bp-fvbx
"What are the various cardinal directions that correspond to the street address ""E 112TH ST""?",i6bp-fvbx
"How many road labels feature the letter ""North"" as a prefix?",i6bp-fvbx
"How many instances in the ""violation_location"" column contain the exact combination of values ""OTHER"", empty strings, and ""OTHER"" in that specific order?",22u3-xenr
How many records in the dataset feature the value '371335' in the inspector_id field?,22u3-xenr
What is the designated category for a specific geographic point defined by its angular distance from the equator and its angular distance from the prime meridian?,22u3-xenr
"What is the count of records that have a specific character ('N') in the ""inspection_waived"" column and a specific numerical value ('3858') in the ""street_number"" column?",22u3-xenr
"What is the count of records that have a specific geographic coordinate of approximately 87.616395376 degrees west and a specific inspection outcome of ""not waived"" in the inspection_waived field?",22u3-xenr
What is the cumulative total of longitudes for all entries that have been designated as unsuccessful or defective in the inspection status category?,22u3-xenr
"What is the specific location referenced in the inspector's notes where the absence of smoke detectors is reported, and the corresponding inspection ID is '14330348'?",22u3-xenr
"What is the total number of records that were most recently updated on the date and time 'May 1st, 2024, 10:19:03 AM'?",22u3-xenr
What is the total count of inspection results that have been designated as unsuccessful or unproductive?,22u3-xenr
Which type of street is typically linked to infractions concerning the upkeep of exterior entranceways and is often found in a specific setting or environment?,22u3-xenr
What is the total number of sworn law enforcement personnel employed on a full-time basis within the Chicago Police Department's organizational structure?,xzkq-xp2w
"What is the total number of personnel within the Chicago Police Department who receive an annual salary of $102,870?",xzkq-xp2w
What is the workplace or organizational unit where Darlene Alexander is currently serving?,xzkq-xp2w
What is the average amount of time spent on the job by full-time truck drivers who operate large vehicles on a regular basis?,xzkq-xp2w
What is the minimum yearly compensation for employees who are paid a fixed wage?,xzkq-xp2w
What is the organizational unit that Nelson J. Alvarado is affiliated with?,xzkq-xp2w
What is the typical annual compensation for employees who receive a fixed income?,xzkq-xp2w
What is the maximum yearly compensation received by Sabrina Aquino-Bergman?,xzkq-xp2w
What is the annual compensation package of Zaireh Acsvecs?,xzkq-xp2w
What is the total number of employees who are employed on a permanent basis and receive a fixed annual income?,xzkq-xp2w
What is the total number of purchase orders that have been formally authorized and confirmed in Harvey?,rsxa-ify5
What is the unique identifier assigned to the supplier for the purchase order with the reference number '1242024'?,rsxa-ify5
What is the count of purchase orders that have a termination date and a total expenditure value both equal to '208600'?,rsxa-ify5
"What is the number of purchase orders with a contractual arrangement designated as ""Delegate Agency"" and a revision level of ""Initial"" that have a non-empty value for the secondary address field?",rsxa-ify5
What is the number of purchase orders linked to a specific vendor with the identifier '84007890X' that have a corresponding value for the secondary address field?,rsxa-ify5
What is the typical vendor identifier associated with purchase orders that have undergone four revisions?,rsxa-ify5
"What is the number of purchase orders with a procurement method of ""Request for Proposal"" and a start date of March 1st, 2019, that have a corresponding contract document in PDF format?",rsxa-ify5
What is the total count of purchase orders bearing the unique identifier '134953' that have a scheduled termination date?,rsxa-ify5
"What is the total number of purchase orders that have a scheduled completion date set for December 31st, 2024?",rsxa-ify5
What is the specific procurement agreement classification for a purchase order with a revision identifier of '27' and a supplier named 'KENNY CONSTRUCTION COMPANY'?,rsxa-ify5
What is the number of educational institutions that exhibit a zero-difference in their exploration and planning phases?,9xs2-f89t
What is the transportation route plan for the educational institution located at the postal code 60615?,9xs2-f89t
"What is the number of educational institutions that have a performance policy level designated by the Chicago Public Schools (CPS) at the specific location defined by the intersection of Sawyer Avenue and a latitude coordinate of approximately 41.87572° North, and a longitude coordinate of approximately -87.6556° West?",9xs2-f89t
What is the symbol representing parental involvement for schools with preschool to kindergarten literacy rates below 10% and a score on the y-axis of less than 60%?,9xs2-f89t
What is the number of 8th-grade students in schools in Austin who are enrolled in algebra classes and also participate in the NDA reading program?,9xs2-f89t
"What is the highest postal code associated with elementary schools that have a moderate level of improvement in math skills, as indicated by the Illinois Standards Achievement Test (ISAT) results?",9xs2-f89t
What is the performance policy level for schools that had an 8th-grade CPS score in 2010 of less than 70%?,9xs2-f89t
What is the lowest percentage of students attending higher education institutions among schools located in the Greater Grand Crossing area?,9xs2-f89t
What is the number of educational institutions that have a specific street address and a corresponding web link that matches the provided URL?,9xs2-f89t
Which educational institutions have a performance evaluation framework that indicates a perfect safety record and an absence of data for 8th-grade Explore Math scores?,9xs2-f89t
"What automobile design was transported to a location with a specific phone number, which begins with the digits '773' and ends with '265-7605'?",ygr5-vcbg
What type of design or aesthetic is characteristic of the vehicle in the state of Illinois?,ygr5-vcbg
"What is the total count of motorized conveyances that were being transported on a trailer on April 26th, 2024, at the stroke of midnight, and were registered in the state of Illinois?",ygr5-vcbg
"What is the lowest identification code of a vehicle that has a distinctive color scheme of light blue and black and was manufactured by a company whose name starts with the letters ""VOLK""?",ygr5-vcbg
"At what point in time was the vehicle with a white exterior and a license plate bearing the combination of letters and numbers ""334Y0"" removed from its original location by a towing service?",ygr5-vcbg
"What is the count of motorized conveyances that were transported to a specific location with a contact number, characterized by the designation ""4D"" and featuring a hue described as ""beige""?",ygr5-vcbg
"At what point in time was a motorized conveyance manufactured by the company ""HOND"" removed from the road in the state of Illinois?",ygr5-vcbg
What is the design or aesthetic category of the vehicle with the unique identifier '1547325' in the state of Illinois?,ygr5-vcbg
What is the total count of motorized conveyances that were transported to a designated location with a specific phone number and inventory code '7090574'?,ygr5-vcbg
What location was the automobile manufactured by Honda transported to?,ygr5-vcbg
What is the total count of data entries that have a specific postal code linked to the unique identifier '2771159'?,4ijn-s7e5
What is the shortest postal code for records with geographic coordinates falling within a specified boundary and a specific permit number?,4ijn-s7e5
What is the unique identifier assigned to the file containing information about a particular location and a heightened degree of danger?,4ijn-s7e5
Which postal codes are associated with entries in the state of Illinois?,4ijn-s7e5
"What is the total count of on-site evaluations conducted within the state of Illinois, focusing on a particular postal code?",4ijn-s7e5
What types of infractions were identified for records associated with a specific license inspection category?,4ijn-s7e5
What is the cumulative total of longitudinal coordinates for all records associated with a particular point in time and geographic location?,4ijn-s7e5
What is the number of data entries that have a matching combination of postal code and street address?,4ijn-s7e5
What is the total number of inspection dates associated with a specific record that is identified by a unique inspection ID and a corresponding business name?,4ijn-s7e5
What is the total number of entries that feature a company name situated within the city limits of Chicago?,4ijn-s7e5
"What significant event occurred on May 5th, 2023 at 3:15 PM, situated at a longitude greater than -87.664282585 degrees?",x2n5-8w5q
"In the dataset, how many times did the domestic variable have a value associated with it when the ward number was specifically 23?",x2n5-8w5q
Which location has a latitude greater than 0.3 and does not have a recorded instance of an arrest being made?,x2n5-8w5q
"What notable event occurred on May 5th, 2023 at 8:50 PM without any law enforcement intervention?",x2n5-8w5q
How many times did the location description appear in the data when the latitude value was within a specific range of 40.855842848 to 42.655842848?,x2n5-8w5q
"How many times did the longitude coordinate appear in the dataset where the secondary description was classified as ""unlawful entry"" and the geographic coordinates pinpointed a specific location at latitude 41.735782636 and longitude -87.62097712?",x2n5-8w5q
What geographical feature was associated with a longitude value of approximately -87.906463155 degrees?,x2n5-8w5q
What is the typical vertical position when the Incident Unique Case Reference is '1320' and the additional information is 'Related to a Vehicle'?,x2n5-8w5q
"On what date and time did the x-coordinate data points occur, coinciding with the condition that the secondary description was limited to a value of $500 or less, and how many such instances were there?",x2n5-8w5q
What is the geographic coordinate when the location type is characterized as a professional or entrepreneurial hub?,x2n5-8w5q
"What is the cumulative sum of the y-axis values when the beat identifier is equal to the sequence ""one-one-one-five""?",ijzp-q8t2
"At what point in time did an incident take place, characterized by a geographical location with a longitude exceeding 8 degrees, and specifically linked to a unique identifier, 'JH246808'?",ijzp-q8t2
What is the largest incident ID assigned to an event that occurred at the address '047XX N KILPATRICK AVE' within the 16th community area?,ijzp-q8t2
What is the standard incident frequency associated with case file 'JH246840' and timestamp '2024-05-09 15:41:50'?,ijzp-q8t2
What is the common neighborhood or district where most events with a longitude value exceeding 4 and situated within the boundaries of Ward 47 tend to occur?,ijzp-q8t2
What is the lowest geographic coordinate associated with crimes in the neighborhood designated as '25' that have been classified under the specific crime category '0560'?,ijzp-q8t2
What is the total sum of the horizontal coordinates for occurrences in the designated neighborhood '23'?,ijzp-q8t2
What is the total number of instances that fall under the specific classification designated by the FBI as '05'?,ijzp-q8t2
What is the highest numerical designation assigned by the Federal Bureau of Investigation to crimes that took place in the calendar year 2024?,ijzp-q8t2
What is the standard incident identifier for occurrences with a specific longitude value of '1141191' and a corresponding FBI classification code of '08B'?,ijzp-q8t2
What was the weekly tally of instances when the cumulative total of instances finally reached 3870?,yhhz-zm2v
"What is the total number of fatalities recorded over a seven-day period, given that the overall proportion of individuals who tested positive for the virus is 21.6% and this is the 16th consecutive week?",yhhz-zm2v
"How many times does the weekly case rate surpass a threshold of 0.7, marking the beginning of a week?",yhhz-zm2v
"What was the total number of instances documented during the seven-day period commencing on October 23, 2022?",yhhz-zm2v
Determine the minimum number of fatalities when the overall infection rate exceeds 30% for the first time.,yhhz-zm2v
"Determine the total number of fatalities within a group of 50,113 individuals.",yhhz-zm2v
"How many times do the cumulative case rates appear when the total number of tests conducted is 373,388 and the total number of deaths recorded is 241?",yhhz-zm2v
"How many times does the cumulative test rate occur when the total number of tests conducted is 385,241 and the weekly death rate is zero?",yhhz-zm2v
"Determine the minimum proportion of tests administered per week when the cumulative total of tests administered over a week is 629,575.8 and the number of individuals in the population is 36,158.",yhhz-zm2v
How many times do cumulative positive test percentages appear when there are no weekly tests conducted and the weekly case rate surpasses 0.3?,yhhz-zm2v
What is the total number of assets being overseen by the 'DPD - Business Development' team in terms of the number of bidding processes?,aksk-kvfp
What are the longitudes associated with parcels having a floor area exceeding 40% of the total area?,aksk-kvfp
Which properties have a neighborhood designation and living space measurement that are both equal to zero?,aksk-kvfp
"What is the typical size, in square feet, of the residential properties that are not managed by a specific entity in the Humboldt Park neighborhood?",aksk-kvfp
What is the aggregate value of the horizontal coordinates associated with the specific real estate parcel distinguished by its unique identifier '25-03-400-012-0000' and its corresponding numerical designation '23807'?,aksk-kvfp
What is the number of real estate properties that have a recorded purchase date and a total living area that lies between 3124.5 and 3125.5?,aksk-kvfp
"What is the approximate total living area, in square feet, for all residential properties located within Ward 27 that have a reported living area of zero square feet?",aksk-kvfp
Which round of offers is linked to properties that are not managed by anyone and have a unique identifier of '10403'?,aksk-kvfp
What is the web address associated with the real estate listing corresponding to the address '919 E 134TH ST' and the unique identifier '34643'?,aksk-kvfp
"What is the number of real estate listings that have been updated most recently on a specific date in 2015, and whose geographic coordinates fall within a narrow range of values?",aksk-kvfp
Which categories of maintenance requests are related to unoccupied structures with geographic coordinates situated in the southernmost 1% of the globe?,7nii-7srd
What is the typical response time for inquiries received on a specific day and site?,7nii-7srd
What is the typical cost per unit of space for structures located within the jurisdiction of Police District 12?,7nii-7srd
"What is the most northerly location where structures have been left to decay, but not due to destruction by flames?",7nii-7srd
What is the total count of structures situated along a thoroughfare with a specific longitudinal position?,7nii-7srd
"Which groups, namely vagrants, minors, or organized groups, tend to inhabit vacant structures at a specific site?",7nii-7srd
What is the smallest house number on Marquette Street that is not currently unoccupied due to a fire?,7nii-7srd
What is the lowest numerical designation for structures that have been left vacant and are no longer in use?,7nii-7srd
"What is the number of structures with a specific parking facility and are currently occupied, excluding those that have been damaged by flames?",7nii-7srd
"""What is the location on the building's perimeter that has a northward or eastward orientation, given that the building is accessible and situated within a specific range of longitude?""",7nii-7srd
Which periods of time were designated to achieve a response within a 10-day timeframe?,qcfn-tiw7
"What is the longest time it takes for the city to respond to a request to remove graffiti, given that it typically takes less than 2 days to complete the removal process and the average time it takes is more than 10 days?",qcfn-tiw7
What is the average time it takes to finish cleaning up all the graffiti when the middle point of the time it takes to clean up each piece of graffiti is just one day and a total of 2160 requests have been completed?,qcfn-tiw7
What is the cumulative sum of the middle-range periods required to fulfill graffiti removal requests when the total number of fulfilled requests reaches 2670 and the desired turnaround time is 10 days?,qcfn-tiw7
"What is the total number of requests that have been fully processed, with the middle value of the time taken to complete graffiti removal requests being exactly one day?",qcfn-tiw7
What is the typical timeframe for achieving a satisfactory outcome when the average duration required to fully eliminate graffiti is precisely 5.94 days?,qcfn-tiw7
"What is the average number of days it takes to finish removing graffiti when there are 2291 completed requests, and the middle value of the time it takes to complete a request is just one day?",qcfn-tiw7
What is the middle value of the time it takes to fulfill graffiti removal requests when the overall average time to complete these requests is approximately 3.7 days?,qcfn-tiw7
"What is the typical time it takes to respond to a request, given that a total of 1942 requests have been successfully fulfilled?",qcfn-tiw7
Which weeks typically take only one day to fulfill graffiti removal requests?,qcfn-tiw7
"Identify the highest community area with a poverty rate of less than 0.0%, where the percentage of households living below the poverty line is significantly low.",kn9c-c2s2
What is the smallest average annual income per person for the neighborhood designated as East Garfield Park?,kn9c-c2s2
Determine the unemployment rate for people aged 16 when the proportion of individuals aged 25 who have not completed high school education exceeds 90%.,kn9c-c2s2
What is the percentage of adults aged 25 who lack a high school diploma when the poverty rate in the '19' community area is less than 8%?,kn9c-c2s2
What is the maximum level of overcrowding that occurs when the percentage of people under the age of 18 or over the age of 64 is 41% and the overall hardship index is 66?,kn9c-c2s2
"Determine the overall proportion of adults aged 25 who lack a high school diploma, given that the jobless rate for 16-year-olds exceeds 60%.",kn9c-c2s2
Determine the minimum hardship index value when the proportion of households with incomes below the poverty threshold exceeds 30%.,kn9c-c2s2
"What percentage of the population in the Near North Side community area falls within the age ranges of under 18 or over 64, where the poverty rate among households is less than 30%?",kn9c-c2s2
"Determine the typical neighborhood classification when the overall quality of life is 69 and the average annual income per person is $15,754.",kn9c-c2s2
"Determine the aggregate percentage of joblessness among people of 16 years old, given that the overall distress level is 34 and the specific neighborhood being examined is the 16th community area.",kn9c-c2s2
"What is the typical vertical position of the geographic points within the region corresponding to the 60639 zip code, considering only those points with a longitude value less than -87.76557448?",z8bn-74gv
"What is the total count of records that have a fax contact detail for the specific geographic area, which is associated with a particular website and physical address?",z8bn-74gv
"What is the number of records that have a district city attribute in the Illinois dataset, where the website field matches the specified website?",z8bn-74gv
What is the southernmost boundary for the geographic area associated with the given postal address and contact information?,z8bn-74gv
What is the total of the geographic coordinates for records featuring the exact fax and phone number combinations?,z8bn-74gv
Which number of administrative subdivisions possess a designated online presence?,z8bn-74gv
What is the total count of data points that have a corresponding y-axis value for the geographic area associated with the given website and physical location?,z8bn-74gv
Can you provide the location details associated with the phone number mentioned?,z8bn-74gv
What is the total of district codes for records with the exact longitude and urban area?,z8bn-74gv
What is the designated area name associated with the specific geographic point mentioned?,z8bn-74gv
What is the postal code for the Windy City?,28km-gtjn
What is the total count of vehicle registration records that contain engine details for the specific location '3509 South Lowe Avenue' in the city of Chicago?,28km-gtjn
"Which individual or entity is associated with the engine model designated as ""E43""?",28km-gtjn
What is the total count of database entries associated with the specific postal code '60634'?,28km-gtjn
What is the total count of data entries that match the exact coordinates and postal code?,28km-gtjn
Which powerplants are typically linked to arrivals at O'Hare International Airport?,28km-gtjn
What is the aggregate total of postal code designations for the specified geographic location?,28km-gtjn
What is the total count of entries that possess a matching postal code and geographic designation?,28km-gtjn
What is the total number of entries that include both a state designation and a zip code identifier?,28km-gtjn
Which individuals are associated with the designated geographical area?,28km-gtjn
"What is the total number of licenses that were both newly granted and had their status modified on February 29th, 2024, at the stroke of midnight?",97wa-y6ff
"What was the number of individuals operating vehicles with a specific classification on October 23rd, 2013, within the state of Illinois?",97wa-y6ff
"Which jurisdiction issues permits to chauffeurs that are set to expire in the month of March, three years from now?",97wa-y6ff
"Which jurisdiction began granting long-term identification cards on September 14, 2023?",97wa-y6ff
"What are the dates when licenses were issued in Illinois, and what was the status of those licenses as of April 2, 2024?",97wa-y6ff
"What is the number of motorists whose driving permits are due for renewal in the month of November, exactly 30 months from the current date?",97wa-y6ff
What are the specific dates when permits for drivers who only provide transportation services are issued?,97wa-y6ff
What is the total number of individuals who operate vehicles for hire in a specific urban area?,97wa-y6ff
What is the number of individuals with a specific driving classification whose driver's permits are set to expire during the month of May in the year 2025?,97wa-y6ff
