question,table
"Which marketing entity is linked to entries labeled as ""Initial Program"" in the ""First Priority"" field?",Motos_1
What is the numerical value associated with the combination of a brand description containing two hyphens and a single-digit advertisement count?,Motos_1
"What is the typical ""Columns"" measurement for records where the ""Day of the Week"" field contains the value '5' and the ""Ad Link"" field matches the exact string 'http://204.51.113.172/videosgt/CB/DISCO/10555.wmv'?",Motos_1
What is the aggregate total of durations for all records featuring the specific identifier '10555'?,Motos_1
What is the specific code designation associated with instances where the frequency of occurrence is singular?,Motos_1
"How many advertisements are marked as ""END OF PROGRAM START"" that have entries containing the specific FTP connection details 'ftp://spotsftpgua:ftgu4t3m4l4@181.48.50.21/tv' in the ""Concatenate 2"" dataset?",Motos_1
How many distinct groups of entries are linked to instances where the advertiser's name is left blank?,Motos_1
Which players have a batting average in the season (K) equal to zero and a batting average on balls in play (BABIP) greater than 0.6?,MLB_41
What is the maximum possible rating in pwRC when the BIP score lies within a narrow range of 73.0 to 74.0?,MLB_41
What is the maximum value that can be obtained in a specific unit (PU) when the indicator 'iBB' has a value of zero?,MLB_41
What is the lowest possible value in a specific formula when the price-to-earnings ratio is extremely low at -112 and the fixed book value is a fixed amount of 100.0?,MLB_41
What is the average value in a Business Intelligence Platform (BIP) when the input Buffer Buffer (iBB) is set to zero and the System Output Signal (SOS) is also set to zero?,MLB_41
"Which number of players in the dataset have a batting average in the ball-in-play (BIP) department that is less than 0.1, yet their weighted runs created (wRC) metric is greater than 0.8?",MLB_41
"What is the number of players who have a weighted Runs Above Average (wRAA) value between 1.6 and 1.8, and also have a year ('14') listed in their career statistics?",MLB_41
"What is the lowest numerical value present in the ""Pitches"" dataset when the value of ""iBB"" is equal to zero?",MLB_41
"What is the number of data points that have a non-missing value in the OBP column, given that the corresponding value in the BB column is equal to zero?",MLB_41
What is the point of inflection when the pressure upstream is negative?,MLB_41
What is the minimum value of SF when PU is equal to zero?,MLB_7
What is the average scoring average when the player's usage is set to one?,MLB_7
"What is the total weighted runs created when a batter's batting average on balls in play (BABIP) is extremely low, ranging from -0.1 to 0.1?",MLB_7
What is the minimum value of the LD column when the team name is specifically 'Danville Braves'?,MLB_7
What is the average batting average on balls in play for players who have played for the Chicago White Sox?,MLB_7
What is the cumulative batting average on balls in play for the 2011 season when a player has hit exactly two home runs?,MLB_7
"What is the outcome of a mathematical formula, designated as Calculation_40532458113208334, when a specific variable, represented by the letter H, has a value of zero, and another variable, denoted by the letters PU, has a value of one hundred?",MLB_7
In what number of positions do the values 'GB' and 'LD' both equal '0'?,MLB_7
What is the number of instances where the ground ball double play (GIDP) occurs when the number of home runs (HR) is zero and the ground ball percentage (GB%) is 100?,MLB_7
What is the total number of parent team values when the GB value is equal to zero?,MLB_7
"What is the number of records that have distinct values in the count column and are associated with the entity ""PHOENIX ORTHOPEDIC AMBULATORY CENTER, LLC""?",Physicians_1
"What is the smallest postal code among healthcare providers participating in the Medicare program, where the average deviation of their payment amounts from the standard Medicare payment is greater than 20%?",Physicians_1
"What is the secondary street address line for entries with a unique identifier of one, and a description that specifically mentions the incision of a finger tendon sheath?",Physicians_1
"What is the typical amount claimed by entries that have a designated location identified as ""F""?",Physicians_1
What is the total number of records that have a designated country of origin and a unique postal code matching the exact sequence '852045013'?,Physicians_1
"What is the difference between the expected and actual payment amounts for surgical procedures classified as ""Eye Incision"" in the submitted claims?",Physicians_1
How many records contain a secondary street address and a service quantity of thirty-seven?,Physicians_1
"What is the number of records that have a designated provider status and a distinct count of 12, with a variation in submitted charge amounts falling within a range of minus 0.5 to plus 0.5?",Physicians_1
"What is the number of records that have a designated Medicare reimbursement amount and a location code of ""F"" associated with the entity ""PINNACLE SURGERY CENTER OF PEORIA""?",Physicians_1
"What is the number of records that have a description length and are associated with the entity ""CANYON AMBULATORY SURGERY CENTER, LLC"" and have exactly 11 distinct descriptions?",Physicians_1
"What is the total count of tweets that include the phrase ""Kuwait"" in their hashtags?",HashTags_1
"What is the total number of entries in the database that feature writers from the United Kingdom or the United States, and include the phrase ""Motive (copy 2)"" in their metadata?",HashTags_1
"What is the typical quantity of entries with a user friend count of twenty-six and including the phrase ""TheNeighbors (copy)""?",HashTags_1
"What is the maximum count of records associated with an author whose ID falls within a specific range, spanning from 539449326.9 to 539449327.1?",HashTags_1
"What is the count of unique author identifiers for which the title ""Rookie Blue"" (specifically, the 5th copy) is absent and the author's full name is ""Peyman Sirab""?",HashTags_1
"What is the average number of acquaintances a Twitter user has, excluding those they explicitly mention in their tweets with the phrase ""TheNeighbors (copy)""?",HashTags_1
Identify the number of entries where the author's linguistic preference is explicitly mentioned and the avatar URL matches the exact string 'http://pbs.twimg.com/profile_images/378800000033687710/91'.,HashTags_1
"What is the number of Twitter user statuses that do not include the phrase ""TheNeighbors (copy)""?",HashTags_1
"Identify the usernames of authors who do not have a duplicate username containing the phrase ""RookieBlue"" and have a specific interaction ID of ""1e38badcf9caa700e07433584de3f8e2"".",HashTags_1
"Identify the earliest author ID that does not contain the title ""RookieBlue (copy 5)"" and has the author's full name as ""Peyman sirab"".",HashTags_1
"What is the typical rate of successful batted balls, excluding those that result in a strike or a ball, for teams with a collective batting average within a narrow range of 16.4 to 17.4?",MLB_54
"What is the number of batting averages that exist when the proportion of fly balls that result in outs is extremely low, and the proportion of strikeouts is extremely high?",MLB_54
What is the maximum Whiff/Swing ratio for entries where a specific calculation yields a value less than 0.3?,MLB_54
"How many times did batters in the 'CaL' league step up to the plate and receive four pitches outside the strike zone, resulting in a walk?",MLB_54
How many instances are there with a specific outcome when only two objects are present?,MLB_54
What is the number of entries that have 15 hits and a range of stolen base values spanning from -0.13 to 1.47?,MLB_54
How many fly balls are recorded in instances where there are 36 total balls in play and two batters are called out on strikes looking?,MLB_54
What is the total number of possible routes for entries that involve exactly two balls?,MLB_54
What is the cumulative sum of balls in play independent of the defense for all instances where a specific formula yields a value of 1.46534653465347 and there are exactly 19 runs batted in?,MLB_54
How many instances of base stealing are there for records that have exactly three instances of a player being walked?,MLB_54
"Which states have Medicare reimbursement rates that exhibit a relatively low degree of variability, with the majority of claims falling within a narrow range of $0.30 or less above or below the mean?",Provider_2
Which healthcare provider in Georgia provides non-invasive sound wave treatment for pain relief and tissue repair?,Provider_2
"How many services does the medical practice ""GARY M ROGGIN, MD, PA"" provide to its patients?",Provider_2
Which entities possess precisely 60 services and a distinct quantity within the narrow range of 20.7 to 21.3?,Provider_2
"What is the total of the maximum amounts that Medicare will pay for medical services provided in areas with a high degree of variation in payment amounts, specifically those designated as ""O"" locations?",Provider_2
What is the number of medical treatments that do not accept Medicare insurance being provided in facilities located in the state of Ohio?,Provider_2
"Which healthcare professionals, with a single corresponding entry in the database, exhibit a specific sex?",Provider_2
"What metropolitan area is home to healthcare professionals whose postal addresses fall within a specific range of numerical codes, spanning from 30265-1327.4 to 30265-1328.6?",Provider_2
"What is the maximum Medicare reimbursement rate for medical procedures with an average cost ranging from approximately $31.25 to $32.45, in the United States?",Provider_2
"What is the current enrollment status of the healthcare professional with the National Provider Identifier ""1528039484"" in the Medicare program?",Provider_2
"What is the cumulative value of all entries categorized as ""Industrial Goods and Services"" in the PBS?",CommonGovernment_8
What is the total number of records that have a matching agency identifier when the funding agency's unique code is equal to '1300229226'?,CommonGovernment_8
"What is the count of records that share the same agency identifier, and also have a signed date of November 16th, 2009, and a contracting office designated as '260-NETWORK CONTRACT OFFICE 20'?",CommonGovernment_8
What is the maximum possible PSC code value when the quarter is designated as '1' and there is only a single record present?,CommonGovernment_8
"What is the total value of the unique identifiers in the ASE table when the timestamp corresponds to November 25th, 2009, at midnight?",CommonGovernment_8
What is the total count of contract identifiers present when the agency identifier is specifically '36'?,CommonGovernment_8
What is the total number of agency designations that appear when the year in question is 2010?,CommonGovernment_8
What are the fundamental classification groups for records associated with the agency identifier '3600'?,CommonGovernment_8
"What is the minimum required amount when the non-GSA dollar value lies between a specific range of values, specifically between $10,571.96 and $10,572.36?",CommonGovernment_8
What categories of honors are linked to entries bearing the agency identifier '3600'?,CommonGovernment_8
"How many records feature a zero in the ""Baseball"" field?",MLB_51
What is the number of instances where the weighted on-base average is equal to 0.454 and the plate appearances are exactly two?,MLB_51
What is the number of records that have an average value of 0.5 in the 'AVG' column and a calculation value of less than 0.4 in the 'Calculation_496521908228587527' column?,MLB_51
What is the cumulative sum of the values within the calculation 'Calculation_496521908228587527' when the 'wRAA' parameter equals -0.5 and the 'Called' parameter is set to '1'?,MLB_51
"What is the average value of ""Ground Into Double Play"" when ""Bases on Balls"" is equal to 2 and ""Number of Bases on Balls"" is 1, in the context of a baseball game?",MLB_51
"What is the lowest numerical value in the ""pwRC"" column when the ""X2B"" column is equal to zero and the ""batter_name"" column is specifically referring to ""Cole Figueroa""?",MLB_51
"What is the number of records that have a non-null value in the 'p_throws' column, given that the 'PA' column has a value of '3' and the 'Called' column has a value of '1'?",MLB_51
What is the lowest numerical value present in the 'wRAA' dataset when the 'Swinging' variable takes on a value of '1'?,MLB_51
"What is the cumulative sum of the values in the ""LD"" column when the ""PU"" value is less than 0.8 and the ""X1B"" value is equal to zero?",MLB_51
"What is the lowest numerical value in the ""pwRC"" column when the value in the ""LD"" column is equal to zero?",MLB_51
What was the difference in the number of residential properties transferred to new owners between the end of July 2009 and the end of August 2009?,Redfin1_1
What is the smallest month-to-month decrease in the median price per square foot in Pennsylvania?,Redfin1_1
"Which of the entries exhibit a variation in median time to sale between consecutive years, with a corresponding inventory level situated within a specific range of 46.3 to 47.7?",Redfin1_1
Which number of entries exhibits a variation in price decreases between consecutive years?,Redfin1_1
What is the total count of records that have a predetermined termination point?,Redfin1_1
"What is the total number of municipalities in Pennsylvania that have been assigned the abbreviation ""PA"" as part of their official designation?",Redfin1_1
"What is the earliest table identification number for records beginning on August 1st, 2009?",Redfin1_1
At what point in time do entries with a precise quantity of 98.0 items begin to be recorded?,Redfin1_1
What is the average proportion of the sale price to the original asking price for property 2429 over a series of consecutive months?,Redfin1_1
Which US state has a median time-to-sale of approximately four months and 24 days?,Redfin1_1
What is the total count of healthcare professionals whose organization name and suite number combination meets the specified requirements?,Taxpayer_6
What is the total count of entries for healthcare service suppliers situated within the United States?,Taxpayer_6
What is the total amount of Medicare payments for medical records with HCPCS codes that fall below a value of 0.5?,Taxpayer_6
What is the typical count of medical procedures listed for patient records that include treatment with high-frequency sound waves?,Taxpayer_6
"Which healthcare professionals have a significant number of patients assigned to them, with a count greater than 0.6?",Taxpayer_6
"What is the typical number of distinct individuals who receive services, considering only records with a standard deviation of submitted charges less than 0.7 and exactly 60 line items?",Taxpayer_6
"What is the mean number of line services offered by healthcare providers situated in areas with low socioeconomic status, as defined by ZIP codes with a poverty rate of less than 30%?",Taxpayer_6
"What is the maximum number of telecommunications services offered by companies with headquarters in Slidell, Louisiana?",Taxpayer_6
What is the entity code given to claims with charges exceeding a certain threshold of $0.60 and Medicare-approved amounts surpassing a specific level of $0.80?,Taxpayer_6
Which entity code corresponds to records that have a submitted charge standard deviation falling within a narrow margin of ±0.1?,Taxpayer_6
"What is the Medicare participation status for surgical procedures with unusually high billing amounts, specifically those classified as ""Eye Incision"" and exceeding the average charge by more than 0.4 standard deviations?",Taxpayer_9
What is the average difference in costs for medical procedures with a Medicare-approved payment of $902.01?,Taxpayer_9
"What is the maximum variation in charge designations for entities labeled as ""Other"" in the Phoenix database?",Taxpayer_9
What is the number of records that have a total number of services provided equal to 43 and a Medicare reimbursement amount falling within a specific range of $413.24 to $414.04?,Taxpayer_9
"What is the total number of entries in the database that have a specific type of healthcare provider associated with an address that includes the phrase ""SUITE 100"" as part of its description?",Taxpayer_9
What is the aggregate number of surgical procedures performed in outpatient facilities?,Taxpayer_9
"What is the secondary address range for medical records with Medicare-approved costs falling between $356.93 and $357.13, and a margin of error within a range of -$0.59 to $0.81?",Taxpayer_9
What are the specific procedure codes assigned to medical facilities or providers that surgically open or dissect the protective covering surrounding a tendon?,Taxpayer_9
What are the codes for entities with fees that exhibit a variation within a narrow range of approximately 0.7 units in either direction?,Taxpayer_9
"What is the Medicare participation status for procedures identified as ""Finger Tendon Sheath Incision"" with charges exhibiting a significant deviation of less than 0.3?",Taxpayer_9
"What was the total number of instances where a player was involved in a stolen base attempt, resulting in a caught stealing, if they were unsuccessful in their attempts on two separate occasions?",MLB_55
Which individual had an International Organization for Standardization (ISO) rating within a narrow range of -0.4 to 0.4 during the calendar year 2011?,MLB_55
What is the number of instances where the LD value exceeds 0.9 and there are no recorded infractions?,MLB_55
What is the minimum career similarity score for players with a defensive efficiency rating of 9 and a park-adjusted weighted runs created per plate appearance of 73?,MLB_55
"Which clubs, as of the month of April, possess a specific metric known as CS with a value of exactly two?",MLB_55
What is the highest batting average with balls in play for players who have accumulated 20 ground balls in April?,MLB_55
Which player has achieved the highest number of double hits while also recording two instances of a ball being caught in the air?,MLB_55
What is the total number of swings at pitches that did not result in a walk or a hit by pitch for players who did not receive an intentional base on balls and did not hit a foul ball?,MLB_55
What is the total outcome of a particular mathematical operation for individuals with a strength attribute value exceeding zero and a leadership attribute value of exactly 8.3?,MLB_55
What is the typical weighted on-base run value for batters who have a certain statistical metric exceeding 0.2 and do not have any balls called strikes during their at-bats?,MLB_55
What is the weighted on-base average for a player who has accumulated 23 plate appearances?,MLB_13
What is the typical heart rate that corresponds to a calculation value of approximately 13.67?,MLB_13
What is the typical score or rating when the numerical result is exactly 3.0?,MLB_13
What is the number of strikeouts when the batting average on balls in play is approximately 45%?,MLB_13
What is the number of plate appearances when the frequency of balls is between 40.9 and 41.9?,MLB_13
What is the cumulative weighted on-base average for players on the Danville Braves who have a batting average on balls in play of 0.368?,MLB_13
What is the total number of plate appearances for players in the Appalachian League?,MLB_13
"What is the highest batting average on balls in play (BABIP) for players who primarily play positions other than pitcher, catcher, and outfielder?",MLB_13
What is the highest weighted on-base average (wOBA) for players with a batting average below 0.8 and a total of nine ground balls?,MLB_13
What is the total number of home runs achieved by baseball players who have a park-adjusted weighted runs created (pwRC) of 296?,MLB_13
How many records exist that have a specific geographic classification and a median sale value less than 90% of the total?,Redfin4_1
"What is the number of fresh listings that have undergone a change in their status compared to the previous year, given that the median price per square foot of these listings falls within a specific range of $150.42 to $151.83?",Redfin4_1
"Which types of properties have a proportion of sales prices that fall within a narrow band, specifically between 13.79% and 13.79%, when compared to their original asking prices?",Redfin4_1
"What is the yearly shift in the proportion of homes sold at a price higher than their original list price for properties with a sale price of $563,000, analyzed by county?",Redfin4_1
What is the total number of newly listed properties when the proportion of sale prices to original list prices is precisely 0.966431085433873 and the quantity of successfully sold homes is 554?,Redfin4_1
"Which specific property categories are linked to the date '2009-01-31', marking the end of a particular time period?",Redfin4_1
What is the yearly variation in the middle value of the sale prices for listings with a unique identifier of 1?,Redfin4_1
"What is the trend in median days on market over the past 30 years, considering the specific range of months of supply (0.6 to 1.6) and examining the relationship between these two variables.",Redfin4_1
Determine the yearly variation in the proportion of sales exceeding the original asking price for all residential property types.,Redfin4_1
What is the number of annual fluctuations in residential property transactions when considering a 30-year time frame?,Redfin4_1
Determine the smallest numerical value that can be obtained when the variable iBB is assigned a value of '0'.,MLB_31
"Identify the number of occurrences where the ""parentteam"" field contains a value and the ""BB"" field has a value less than 0.8.",MLB_31
Determine the total value of K when the product of A and B is equal to 8.,MLB_31
"Determine the average value of AB when the average grade falls within the range of 0.0 to 0.8 and the student's name is ""2"".",MLB_31
Identify the number of occurrences where the batter name is present and the batting average is below 0.8.,MLB_31
"Determine the average score when the values for Ba and H are 35.3 and 19, respectively.",MLB_31
Determine the average strength when the value of X2B is equal to 5 and the value of SOL is equal to 3.,MLB_31
What is the GIDP value associated with the parent team 'Atlanta' that I need to retrieve?,MLB_31
What is the minimum value of the SOL when the SF parameter is set to zero?,MLB_31
"Identify the number of occurrences where the combination of ""LD"" equals ""26"" and ""HBP"" equals ""3"" simultaneously.",MLB_31
"What is the typical number of lines of service that healthcare providers in Georgia typically offer to patients, considering that each patient has an average of 16 days of service utilization?",Provider_1
What is the typical out-of-pocket expense for medical services rendered by healthcare professionals who are not participating providers in the Medicare program?,Provider_1
What percentage of healthcare professionals in each state opt out of participating in the Medicare program?,Provider_1
"What is the minimum number of lines offered by US healthcare providers whose Medicare reimbursement amounts exhibit a variability, measured by standard deviation, within a specific range of 13.04 to 14.44?",Provider_1
"What is the count of healthcare professionals holding the unique identifier ""1144593146"" and are based in the United States?",Provider_1
"Which healthcare professionals are located at the address ""10215 FERNWOOD RD"" and have fewer than 0.3 patient days of care provided?",Provider_1
What is the secondary street address information for healthcare professionals associated with the location '8120 WOODMONT AVE'?,Provider_1
"What is the total number of healthcare professionals whose professional affiliations are listed under the name ""CHRISTINE A. CURLEY M.D. P.C.""?",Provider_1
"What is the number of healthcare professionals who have a secondary postal address when their primary address is ""1271 7TH ST"" and they have a total of 12 individuals who are receiving benefits from them?",Provider_1
"What is the typical reimbursement amount for healthcare services provided at the address 49 LAKE AVE, as determined by Medicare?",Provider_1
"Which individuals possess a mobility classification of ""fully active"" and have a professional history in the field of forestry?",SalariesFrance_2
What is the specific airport code used to identify travel itineraries that involve a single passenger?,SalariesFrance_2
"What is the ultimate location for the position of ""Head of Livestock and Crop Integration"" in the Rome library?",SalariesFrance_2
"Who are the individuals responsible for operating and maintaining farm equipment and forestry machinery, and what is their occupational code in the Rome destination?",SalariesFrance_2
"What is the count of records that have a specific travel origin in Rome and a particular mode of transportation, as well as a unique identifier for that mode of transportation equal to 1?",SalariesFrance_2
What is the International Standard Classification of Occupations (ISCO) code for a professional involved in the management and maintenance of forests and woodlands?,SalariesFrance_2
"What is the intended library location for individuals with a mobility impairment classification of ""severely impaired"" and a preferred proximity to the library of ""very close""?",SalariesFrance_2
What is the number of specific codes linked to the occupation of cultivating poplar trees?,SalariesFrance_2
