question,table
What is the number of distinct vehicle models in Illinois that are associated with a particular tow facility and have a unique phone number for towing services?,ygr5-vcbg
How many distinct phone numbers are associated with a particular automotive brand's roadside assistance services?,ygr5-vcbg
"On what date in 2024 was a particular vehicle manufacturer transported to a designated location, accompanied by a specific phone number and a distinct design element?",ygr5-vcbg
"Which jurisdiction was the motorized conveyance relocated to, accompanied by a distinct phone number and a particular aesthetic, on May 3rd, 2024?",ygr5-vcbg
Can you provide me with the phone number of the towing service responsible for a vehicle with a unique identification number?,ygr5-vcbg
What is the exact quantity of motorized transportation units in the state of Ohio that possess a distinct aesthetic design and are identified by a unique numerical code?,ygr5-vcbg
What is the total count of towing events associated with vehicles of a particular make and corresponding tow facility contact number?,ygr5-vcbg
What is the typical quantity of vehicles from a particular manufacturer that were relocated to a designated site due to being impounded?,ygr5-vcbg
What is the total number of locations associated with the specific inspection record having the unique identifier 2593296?,4ijn-s7e5
What is the standard meridian associated with inspection record 2593001?,4ijn-s7e5
What is the total number of possible results or consequences associated with the specific Illinois driver's license number 2718022?,4ijn-s7e5
What is the number of instances where the latitude falls short of a value of 0.9?,4ijn-s7e5
"Which company is expected to achieve a satisfactory result on April 17, 2024?",4ijn-s7e5
What is the total number of establishments situated at the address 2545 N HALSTED ST in the city of Chicago?,4ijn-s7e5
What types of companies are located in the city of Chicago?,4ijn-s7e5
What is the standard meridian coordinate associated with the postal code 60644?,4ijn-s7e5
"What is the total number of sites associated with inspection ID 2593878, which corresponds to a geographic coordinate of approximately 41.80983241507112 degrees latitude?",4ijn-s7e5
What is the number of company names associated with the 60620 postal code that have been flagged for a particular regulatory infraction?,4ijn-s7e5
What is the total number of occurrences recorded at a location with a specific y-coordinate value of 1831361 and situated on a street with the address 0000X W 111TH ST?,x2n5-8w5q
What incidents occurred at the specific street address '078XX S PEORIA ST' with a corresponding y-coordinate value of '1852916'?,x2n5-8w5q
Which regions were impacted in cases where there was no involvement from individuals residing at the affected location?,x2n5-8w5q
"What are the locations along the street address ""021XX W BELMONT AVE"" that have coordinates with longitudes falling within the range of -92.681384786 to -82.681384786?",x2n5-8w5q
What are the specific latitude and longitude values associated with occurrences classified under the FBI designation '09' and situated within the geographic region identified as '833'?,x2n5-8w5q
"What is the total count of occurrences documented for descriptions of crime scenes related to motor vehicle thefts, specifically those with a Uniform Crime Reporting (UCR) code of 0920?",x2n5-8w5q
"What is the total number of distinct incident categories reported on the street address ""008XX W 95TH ST"" that correspond to the FBI crime category ""04A""?",x2n5-8w5q
"What is the total number of instances where individuals were taken into custody for events that took place within a specific geographic range, defined by a latitude band between 41.142043507 and 42.542043507, and specifically related to a particular case, identified as 'JG249883'?",x2n5-8w5q
What is the level of community participation in reported occurrences at the location '052XX N CLARK ST'?,x2n5-8w5q
"What is the total count of reported occurrences for specific dates in regions associated with beat number 1913, where the location type is classified as a residential area?",x2n5-8w5q
Determine the aggregate of longitudinal coordinates for instances with a specific FBI classification ('08B') and a particular Uniform Crime Reporting code ('0486').,ijzp-q8t2
Determine the quantity of instances where the eastward direction is exceeded.,ijzp-q8t2
"Determine the earliest possible longitude value for instances that took place within a residential unit and were modified on May 9th, 2024, at 3:41:50 PM.",ijzp-q8t2
Determine the mean vertical position for instances where the longitudinal position exceeds 8 degrees.,ijzp-q8t2
Determine the aggregate of unique identifiers assigned to instances where law enforcement did not apprehend a suspect.,ijzp-q8t2
Determine the frequency of revised timestamps associated with incidents that occurred at the address '012XX W PRATT BLVD'.,ijzp-q8t2
Identify the instances that do not pertain to household or family-related issues.,ijzp-q8t2
Determine the total number of places that correspond to the FBI designation '08A'.,ijzp-q8t2
Identify the instances that occurred within the geographic coordinates spanning from 41.378846126 degrees north to 42.378846126 degrees north.,ijzp-q8t2
Obtain the unique identifier assigned by the Federal Bureau of Investigation for the specific case file designated as 'JH248235'.,ijzp-q8t2
What is the number of data points that have a weekly test rate falling between a low of -0.042 and a high of 0.158 for the percentage of positive test results?,yhhz-zm2v
What is the average overall mortality rate for instances with 2225 weekly examinations and a positivity rate exceeding 70%?,yhhz-zm2v
"What is the maximum number of weekly assessments for entries that concluded on October 28th, 2023, and collectively had a total of 371,795 evaluations?",yhhz-zm2v
"What is the smallest overall testing frequency for data points with a corresponding population size of 34,311?",yhhz-zm2v
What is the total count of weekly examinations for entries that have a proportion of positive test results equal to 5.9%?,yhhz-zm2v
What is the minimum number of individuals that can be present in a group without experiencing any fatalities within a seven-day period?,yhhz-zm2v
What is the average number of total fatalities across all entries that reported 65 cases within a seven-day period?,yhhz-zm2v
What is the average overall performance score for instances where there were no fatalities during the week and a total of 139 new cases reported throughout the week?,yhhz-zm2v
What is the smallest number of fatalities per week for records with a postal code of 60614?,yhhz-zm2v
What is the maximum cumulative count of cases for entries that have a weekly incidence rate falling within the narrow range of 84.7 to 85.7?,yhhz-zm2v
Determine the cumulative sum of identification numbers associated with a geographic location having a latitude value of approximately 41.777882869978875 degrees.,aksk-kvfp
"What is the most recent date of modification for the record associated with East Garfield Park, which has a community area designation of 27?",aksk-kvfp
"Determine the lowest possible property value for properties with a floor area between 3154.6 and 3155.4, as of March 14, 2024.",aksk-kvfp
What is the current sales condition for the record with the unique identifier 21737?,aksk-kvfp
What is the web address associated with the specific location at 3811 South Kedzie Avenue?,aksk-kvfp
How many data points have a horizontal position and a zero vertical position?,aksk-kvfp
"Determine the number of records with a ZIP code that was modified on the 14th day of March, 2024.",aksk-kvfp
"Identify the number of records that have a ward value situated within a narrow geographic boundary of approximately 0.2 degrees in latitude, spanning from 0.1 degrees south to 0.1 degrees north.",aksk-kvfp
"Identify the specific records that show a property valuation date of June 2, 2000.",aksk-kvfp
What is the maximum Y-coordinate value associated with the entry having the unique identifier 22163?,aksk-kvfp
"Determine the lowest house number in Ward 17, considering the specific location.",7nii-7srd
Identify the smallest postal code associated with a particular service request identifier and a specific street address.,7nii-7srd
What is the type of suffix that would be used to describe a vacant structure located at the back of a street?,7nii-7srd
Determine the highest numerical address of a vacant property within the boundaries of Ward 17.,7nii-7srd
Determine the quantity of unoccupied structures within the boundaries of Ward 34.,7nii-7srd
"Determine the number of postal codes associated with a particular location, including a specific house number and directional indicator.",7nii-7srd
Identify the condition of structures with a geographical location east of the 3rd meridian.,7nii-7srd
"Identify the presence of vagrants, minors, or organized groups utilizing a particular site within a designated police jurisdiction.",7nii-7srd
Determine the street suffix for a particular address that includes a directional indicator and a specific date for a service request.,7nii-7srd
"""Obtain the timestamp when a building located at the entrance received a request for assistance.""",7nii-7srd
What proportion of weeks have an average number of days to complete graffiti removal that lies between 0.95 and 2.55?,qcfn-tiw7
"What is the typical midpoint of the timeframe required to fulfill graffiti removal requests, considering that the duration of removals varies between approximately 1 hour and 2 hours and 15 minutes?",qcfn-tiw7
"What is the number of requests that have been fully processed, with the middle value of the time taken to complete graffiti removal being exactly 4 days?",qcfn-tiw7
"What is the cumulative median duration required to fulfill all graffiti removal requests, assuming a goal of processing each request within 10 days, and considering a total of 2446 requests have been successfully completed?",qcfn-tiw7
"What is the number of weeks for which the midpoint of the time it takes to remove graffiti is just one day, and the overall average time required for removal is approximately 2 days and 6 hours?",qcfn-tiw7
"What is the typical duration of time taken to respond to all requests from March 5th to March 11th, 2012, considering a total of 1942 requests were successfully completed?",qcfn-tiw7
"What is the cumulative duration required to complete all graffiti removal tasks, given that the midpoint of the time taken for each task is 1 day and a total of 2179 tasks have been successfully completed?",qcfn-tiw7
"What is the typical duration between the submission of graffiti removal requests and their completion during the week of April 9-15, 2012, assuming the average removal time is significantly longer than zero days?",qcfn-tiw7
What is the maximum number of fulfilled requests that have been processed within a timeframe of 10 calendar days?,qcfn-tiw7
"What is the cumulative total of weeks for all completed requests, with a median duration of 72 hours for the removal of graffiti, amounting to a total of 2485 requests?",qcfn-tiw7
"What is the typical neighborhood classification when the proportion of households with overcrowding conditions ranges from 3.2% to 4.0%, and the overall community's level of economic and social challenges is moderate, with a hardship index score of 24?",kn9c-c2s2
What proportion of adults aged 25 and over lack a high school education in areas with a high level of economic distress and a relatively low unemployment rate of 6.6%?,kn9c-c2s2
"What is the number of instances where the proportion of residents living in cramped housing conditions is substantial, and a notable portion of the population consists of minors or seniors?",kn9c-c2s2
"Which geographic areas with a median annual income of approximately $15,957 have the highest proportion of adults aged 25 and older who have not completed high school?",kn9c-c2s2
What is the typical level of residential overcrowding in areas where nearly three out of every ten residents live below the poverty line?,kn9c-c2s2
"What is the typical unemployment rate in areas where the poverty level is relatively low, at less than 2%?",kn9c-c2s2
"Which community areas have a significant proportion of adults aged 25 and over who lack a high school education and are experiencing severe socioeconomic challenges, as measured by a hardship index of 97?",kn9c-c2s2
What is the percentage of people belonging to either the youthful population (under 18 years old) or the senior population (over 64 years old) in areas where the rate of housing overcrowding is approximately 7.7%?,kn9c-c2s2
"What is the typical percentage of people within a certain age bracket, namely those below the age of 18 or above the age of 64, in areas where the average individual's income is approximately $12,961, and where there is a specific range of individuals aged 25 and older who do not possess a high school diploma?",kn9c-c2s2
What is the lowest numerical designation of a neighborhood within the Garfield Ridge district?,kn9c-c2s2
What is the total number of online platforms with unique domain names registered and accessible in the state of Illinois?,z8bn-74gv
"What is the numerical significance of the phone number ""312-745-3639"" in terms of geographic coordinates?",z8bn-74gv
What are the telephone facsimile transmission numbers for specific geographic areas within a defined angular distance from the equator?,z8bn-74gv
Can you provide the fax contact information for the administrative region associated with the postal code 60609?,z8bn-74gv
What online platforms are linked to the geographic coordinates 41.8735822883° latitude and -87.705488126° longitude?,z8bn-74gv
Which jurisdictions are associated with a particular geographic address and a unique telephone number?,z8bn-74gv
What is the number of fax numbers whose corresponding y-coordinates fall within the range of 0 to 0.2?,z8bn-74gv
What are the fax numbers linked to a particular phone number and situated below a vertical position of approximately 40% on the y-axis?,z8bn-74gv
Which states have an x-coordinate associated with their address that falls below 0.8?,z8bn-74gv
What is the most westerly geographic coordinate for the address '1412 S Blue Island Ave'?,z8bn-74gv
What is the shortest postal code associated with the location known as 'E103'?,28km-gtjn
"What is the specific numerical sequence used for mail delivery purposes in the vicinity of the address ""6030 North Clark Street"", which is associated with the location known as ""E70/E59""?",28km-gtjn
What is the total count of locations that share the specific postal code '60647' and the exact street address '2179 N STAVE ST'?,28km-gtjn
"What is the most elevated zip code associated with the city of Chicago, specifically referencing the address 1244 North Western Avenue, Chicago, Illinois 60622?",28km-gtjn
"What is the number of associations connected to the specific address ""7101 South Parnell Avenue, Chicago, Illinois 60621"" and the particular engine model ""E54""?",28km-gtjn
What is the shortest and most compact zip code in the metropolitan area of Chicago?,28km-gtjn
What is the geographical coordinates of the location referred to as 'E79'?,28km-gtjn
"What is the location of the area designated as ""E104"" at the address ""11641 South Avenue O""?",28km-gtjn
"What is the total number of jurisdictions associated with the specific location ""21 West 59th Street"" and the identifier ""E84""?",28km-gtjn
"What is the most compact postal code associated with the address ""7659 South Pulaski Road"" when using the mapping engine ""E64""?",28km-gtjn
"What is the current standing of the permit that was granted on April 26, 2024?",97wa-y6ff
What is the number of male license holders who possess a perpetual permit?,97wa-y6ff
What is the current state of the license expirations in the city of Chicago?,97wa-y6ff
"What is the date by which Pittard, Deandre L's professional authorization will no longer be valid, assuming it was initially granted on December 26, 2023?",97wa-y6ff
What is the sex of the person living in the rural area?,97wa-y6ff
"What is the current standing of the permits issued to men that are set to expire in the month of October, 2025?",97wa-y6ff
What is the total number of records associated with the person named Ilgiz Ermatov in the state of Illinois?,97wa-y6ff
What is the number of municipalities linked to gentlemen whose driver's permits were granted on the fifteenth day of December in the year 2023?,97wa-y6ff
"What is the current standing of the permit held by Syed A Hussaini in Chicago, specifically regarding its expiration and potential for renewal?",97wa-y6ff
"What is the largest license plate number among those set to expire in the month of March, exactly two years from now?",97wa-y6ff
"What is the total count of unique account identifiers associated with the individual ANASE and the corporate entity TONY'S STOP & SAVE, INC.?",ezma-pppn
"Which companies are privately held by proprietors whose ownership structure is classified as ""Other"" in business records?",ezma-pppn
"Identify the individuals whose first name is KEVIN and have a middle initial, then count the number of such individuals.",ezma-pppn
"How many business owners have a surname listed when the business is identified as ""Haifa S Mustafa""?",ezma-pppn
Which individuals with the surname NELSON and a secondary name prefix have a middle name or initial?,ezma-pppn
"Identify the unique identifiers associated with individuals holding the position of ""SECRETARY"" and provide a count of the total number of such identifiers.",ezma-pppn
Identify the individuals with a middle name initial associated with the specific account number 485516.,ezma-pppn
"Identify the individuals with a title suffix when their title is specifically designated as ""Managing Member"".",ezma-pppn
Which individuals with the surname FALK have personal names that come before their family name?,ezma-pppn
"Identify the individuals holding the position of ""President"" and having a surname, and then tally the number of such individuals.",ezma-pppn
What is the total number of instances among non-Latinx individuals if there is one fatality among White individuals who do not identify as Latinx and 22 cases of illness among White individuals who do not identify as Latinx?,naz8-j4nc
"Determine the frequency of occurrences for people within the age range of thirty to thirty-nine years, given that there are no fatalities recorded among individuals within the age bracket of sixty to sixty-nine years.",naz8-j4nc
What is the minimum number of instances required for the 40-49 age group when there are six female hospitalizations in the dataset?,naz8-j4nc
"Determine the mean number of hospital stays for people between 18 and 29 years old, assuming there are no fatalities among Asian individuals who do not identify as Latinx.",naz8-j4nc
"What is the minimum number of fatalities among people in the age range of 70 to 79 years old, given that there are 133 reported cases among Black individuals who are not of Latin American descent?",naz8-j4nc
What is the maximum number of hospitalizations experienced by non-Latinx White individuals when there are 62 instances of hospitalization among individuals within the age range of 30 to 39 years old?,naz8-j4nc
"Determine the number of fatalities within the age range of 70 to 79 years, given that the total number of reported cases is 47.",naz8-j4nc
Determine the minimum number of instances required for non-Latinx White individuals when the ethnicity of hospital admissions is unidentified and the race/ethnicity of cases is also unknown.,naz8-j4nc
Identify the number of fatalities among individuals of Latin American descent when there are no recorded fatalities among Asian individuals who do not identify as Latinx.,naz8-j4nc
"What is the minimum number of hospitalizations that can occur among individuals of non-White, non-Latinx ethnicity, given that there are a total of 5 hospitalizations among individuals of all races/ethnicities, excluding White non-Latinx individuals?",naz8-j4nc
Determine the aggregate of designated velocity restrictions for incidents documented at the site of occurrence.,85ca-t3if
What type of traffic sign is typically used to manage traffic flow in situations where a collision has occurred involving a stationary vehicle and two people who have suffered minor injuries that do not require immediate medical attention?,85ca-t3if
What is the maximum street address associated with incidents that took place under favorable atmospheric conditions?,85ca-t3if
How many records show a match for accidents resulting in injuries that do not require hospitalization?,85ca-t3if
Determine the variety of incident classification categories for occurrences with a geographic east-west position exceeding 3 degrees.,85ca-t3if
Determine the frequency of longitude coordinates associated with incidents where equipment was operating correctly and the road surface was free of moisture.,85ca-t3if
Identify the maximum street address associated with a particular crash record identifier and daytime illumination conditions.,85ca-t3if
"What is the value of ""dooring_i"" for incidents involving physical harm and slippery road surfaces?",85ca-t3if
Determine the total number of sites where mishaps occurred on the sixth day under conditions of perfect weather clarity.,85ca-t3if
Determine the total count of crash records with severe harm or damage for a distinct crash identifier.,85ca-t3if
"At what point in time does the authorization for commercial operations become effective for companies that have been designated as ""Authorized Agent for Insurance"" (AAI)?",r5kz-chrr
What is the total Social Security Administration (SSA) contribution for all companies operating within the boundaries of precinct number eleven?,r5kz-chrr
How many establishments with a permit description indicating a commercial food sales outlet exist?,r5kz-chrr
Which companies have a rating higher than 60%?,r5kz-chrr
"What is the original registration date for companies whose application has a scheduled termination date of August 15, 2025?",r5kz-chrr
"What kind of eatery is located at the address 705 S Seeley Ave, 1st floor, and serves Mediterranean-inspired cuisine?",r5kz-chrr
"What is the number of conditional approvals held by CBM PREMIER MANAGEMENT LLC, a company located in Ward 23?",r5kz-chrr
What percentage of Illinois-based companies have a predetermined point in time when their licenses or permits will no longer be valid?,r5kz-chrr
"What is the current standing of pending business approvals that are set to expire on May 15th, 2024?",r5kz-chrr
In which metropolitan area do companies situated within the geographic boundaries of precinct 40-3 operate?,r5kz-chrr
What is the lowest numerical identifier for the neighborhood in which the property located at 4533 North Clark Street is situated?,s6ha-ppgi
What is the standard neighborhood classification for parcels with a vertical axis value exceeding 70% of the total range?,s6ha-ppgi
What is the average neighborhood classification for all the properties being managed by the company known as 'D Properties'?,s6ha-ppgi
What is the total count of phone numbers linked to real estate assets overseen by 'The Inverbrass Funds LLC'?,s6ha-ppgi
What is the scope of real estate management services offered by 'Fulton Grace Realty'?,s6ha-ppgi
What is the designated neighborhood identifier for parcels with longitudinal coordinates ranging from 1151092.258 to 1151093.258 within the 60618 postal code boundary?,s6ha-ppgi
What is the average geographic position for residential buildings with six dwellings in the Uptown neighborhood?,s6ha-ppgi
Can you provide the postal code for the residence located at 1137 East Bowen Avenue?,s6ha-ppgi
What is the total count of distinct identifiers linked to the phone number '773-638-0386'?,s6ha-ppgi
What is the farthest point from the equator where properties can be found with the phone number '773-743-3699'?,s6ha-ppgi
Is there a current permit with ID number 100181219 that has not had the required zoning fee waived?,ydr8-5enu
"How many records have a pin2 value and a street number of 2324, where the subtotal has been waived to the amount of 40?",ydr8-5enu
"What is the purpose of a city code 14 entry when the fee subtotal is zero, and how does it relate to other entries?",ydr8-5enu
"How many records in the dataset have a non-null value in the ""Pin2"" column for the specific street number 810?",ydr8-5enu
"How many records in the dataset feature a non-null value in the ""Contact 13 Name"" column, specifically for entries with a review type of ""EASY PERMIT"" and a street number of 2722?",ydr8-5enu
"How many records in the ""Contact 12 City"" column have a value corresponding to the city ""Chicago"" for contact number 2?",ydr8-5enu
"What is the smallest value in the ""Zipcode"" column for contacts of type ""OWNER"" and with an issue date of July 17, 2007?",ydr8-5enu
"How many records in the database contain a non-null value in the ""Contact 13 Name"" field for the permit with the ID ""100106060""?",ydr8-5enu
"What is the lowest value in the ""Zipcode"" column when considering only the records with a ""Review Type"" of ""SIGN PERMIT""?",ydr8-5enu
"What is the highest amount of a sub-total that was exempted for a specific date of October 9th, 2009?",ydr8-5enu
What is the smallest neighborhood or district that a trip with a rating of less than 2 and a unique identifier of '36fbb628f333cf2a39d450485ea41df93d5b2554' is associated with?,wrvz-psew
"Which journey has a total distance traveled of zero and began at the stroke of 10:30 PM on December 31st, 2023?",wrvz-psew
